Item No.;Item Description;VatGourpSa;VatGroupPu
EES3GER002;Geraldine Traditional Cheese Straws 12/4.5oz;PPN_01;PPNM_08
EES3HRO001;HERO BABY PEAR & BANANA 115GR X 12PC/CTN;PPN_01;PPNM01
EES3HRO002;HERO BABY 4 FRUITS 115GR X 12PC/CTN;PPN_01;PPNM01
EES3HRO003;HERO BABY FRUITS COCKTAIL 115GR X 12PC/CTN;PPN_01;PPNM01
EES3HRO004;HERO BABY APPLE 115GR X 12PC/CTN;PPN_01;PPNM01
EES3HRO005;HERO BABY BEEF WITH MIXED VEGETABLES 200GR X 12PC/CTN;PPN_01;PPNM01
EES3HRO006;HERO BABY BEEF WITH CARROTS 200GR X 12PC/CTN;PPN_01;PPNM01
EES3HRO007;HERO BABY CHICKEN WITH VEGETABLES 200GR X 12PC/CTN;PPN_01;PPNM01
EES3HRO008;HERO BABY CHICKEN WITH RICE 200GR X 12PC/CTN;PPN_01;PPNM01
EES3HRO009;HERO BABY MIXED VEGETABLES 200GR X 12PC/CTN;PPN_01;PPNM01
EES3HRO010;HERO BABY CREAM VEGETABLES 200GR X 12PC/CTN;PPN_01;PPNM01
EES3HRO011;HERO BABY GRAPE, ORANGE & BANANA JUICE 130ML X 12PC/CTN;PPN_01;PPNM01
EES3HRO012;HERO BABY MIXED FRUIT JUICE 130ML X 12PC/CTN;PPN_01;PPNM01
EFR3ABY001;ABBAYE FRENCH PURE BUTTER BISCUITS 12X125GR;PPN_01;PPNM01
EFR3ABY002;ABBAYE FRENCH BUTTER COOKIES MIXED BERRIES 10X150GR;PPN_01;PPNM01
EFR3ABY003;ABBAYE FRENCH BUTTER COOKIES LEMON/ALMOND 10X150GR;PPN_01;PPNM01
EFR3ABY004;ABBAYE FRENCH BUTTER COOKIES CARAMEL 10X150GR;PPN_01;PPNM01
EFR3ABY005;ABBAYE CHOCOLADISES MILK CHOCOLATE 12X135GR;PPN_01;PPNM01
EFR3ABY006;ABBAYE CHOCOLADISES DARK CHOCOLATE 12X135GR;PPN_01;PPNM01
EFR3ABY007;ABBAYE CHOCOLADISES HAZELNUTS NOISETTES 12X130GR;PPN_01;PPNM01
EFR3ABY008;ABBAYE FRENCH BUTTER COOKIES MILK CHOCOLATE 12X135GR;PPN_01;PPNM01
EFR3ABY009;ABBAYE KS PARIS JE T'AIME 12X315GR;PPN_01;PPNM01
EFR3ABY010;ABBAYE KS PARIS ROSE 12X315GR;PPN_01;PPNM01
EFR3ABY011;ABBAYE KS ROSACE 12X315GR;PPN_01;PPNM01
EFR3ABY012;ABBAYE KS CARTES POSTALES 12X315GR;PPN_01;PPNM01
EFR3ABY013;ABBAYE PLUMIER PARIS 12X180GR;PPN_01;PPNM01
EFR3ABY014;ABBAYE SMALL SYLINDRICAL TINS GALETTES NORMANDES 12X65GR;PPN_01;PPNM01
EGM3SBG001;SEEBERGER MICROWAVE POPCORN SWEET 22X100GR;PPN_01;PPNM_08
EGM3SBG002;SEEBERGER MICROWAVE POPCORN SALTED 22X100GR;PPN_01;PPNM_08
EGM3SBG003;SEEBERGER MICROWAVE POPCORN SALT&PEPPER 25X90GR;PPN_01;PPNM_08
EGM3SBG004;SEEBERGER MICROWAVE POPCORN CARAMEL 25X90GR;PPN_01;PPNM_08
EGM3SBG005;SEEBERGER NUTS N BERRIES 13X150GR;PPN_01;PPNM_08
EGM3SBG006;SEEBERGER LUXURY NUT 7 RAISINS MIX 13X150GR;PPN_01;PPNM_08
EGM3SBG007;SEEBERGER BERRY NUT MIX 13X150GR;PPN_01;PPNM_08
EGM3SBG008;SEEBERGER SOFT CHERRIES 13X150GR;PPN_01;PPNM_08
EGM3SBG009;SEEBERGER SOFT FIGS 13X150GR;PPN_01;PPNM_08
EID1HAL001;Wendys Guava Juice 1 x 2 liters;PPN_01;PPNM01
EID1HAL002;Wendys Orange Juice 1 x 1 liters;PPN_01;PPNM01
EID1MIU001;SURANGSANG KIMCHI (CABAGE KIMCHI IN PET) 6 X 1.2KG;PPN_01;PPNM_08
EID1MIU002;SURANGSANG KIMCHI (CABAGE KIMCHI IN PAPER CASE) 2 X 5KG;PPN_01;PPNM_08
EID1MIU003;SURANGSANG KIMCHI (CABBAGE KIMCHI IN PET)  12X600GR;PPN_01;PPNM01
EID2ANW001;A&W BCH Brownies 96pcsx60gr;PPN_01;PPNM_08
EID2BCH001;BCH BROWNIES WITH CHOCO CHIP RTE RETAIL 96 x 60 GR;PPN_01;PPNM_08
EID2BCH002;BCH Brownies with Almond 96 x 60 gr;PPN_01;PPNM_08
EID2BEF001;Wendys Nugget 20 x 48 pieces x 14gr;PPN_01;PPNM_01
EID2KEW001;KEWPIE SCRAMBLED EGGS BASE 6X2KG;PPN_01;PPNM01
EID2KEW002;KEWPIE TAMAGOYAKI WITH DASHI 15X500GR;PPN_01;PPNM01
EID2KEW003;KEWPIE PASTEURIZED EGGS WHITE 10KG/CTN;PPN_01;PPNM01
EID2KEW004;KEWPIE TAMAGOYAKI WITH CRAB STICK 15X500GR;PPN_01;PPNM01
EID2KEW005;KEWPIE TAMAGOYAKI (LW) 18X400GR;PPN_01;PPNM01
EID2KEW006;KEWPIE CRF KOREAN GOCHUJANG 14 X 700GR;PPN_01;PPNM_08
EID2KEW007;KEWPIE CRF JAPANESE SALTED ONION (NEGISHIO) 14 X 700GR;PPN_01;PPNM_08
EID2KEW008;KEWPIE CRF JAPANESE CURRY 14 X 700GR;PPN_01;PPNM_08
EID2KEW009;KEWPIE EGG MAYO 12 X 1KG;PPN_01;PPNM01
EID2LOC001;SIOMAY 1 X 30 PCS;PPN_01;PPNM01
EID2SIE001;FRIED CHICKEN WONTON SIEPACK 12x20PCS;PPN_01;PPNM01
EID2SPP001;Frz Chicken Inject 2 pcs/pkt;PPN_01;PPNM_01
EID3CDA001;SJORA PEACH MANGO CONCENTRATE;PPN_01;PPNM01
EID3CJW001;SWEET POTATO GLASS NOODLE 10 X 1KG;PPN_01;PPNM_08
EID3IBL001;VERMICELI 10 X 1KG;PPN_01;PPNM_08
EID3KEW001;KEWPIE MAYONNAISE ORIGINAL 6X1KG;PPN_01;PPNM01
EID3KEW002;KEWPIE MAYO BASE TYPE 6X1KG;PPN_01;PPNM01
EID3KEW003;KEWPIE MAYO BASE TYPE 4X3KG;PPN_01;PPNM01
EID3KEW004;KEWPIE BAKING MAYO 6X1KG;PPN_01;PPNM01
EID3KEW005;KEWPIE SALAD DRESSING ROASTED SESAME 6X1L;PPN_01;PPNM01
EID3KEW006;KEWPIE SALAD DRESSING JAPANESE SOY SAUCE 6X1L;PPN_01;PPNM01
EID3KEW007;KEWPIE SALAD DRESSING CAESAR 6X1L;PPN_01;PPNM01
EID3KEW008;KEWPIE SALAD DRESSING THOUSAND ISLAND 6X1L;PPN_01;PPNM01
EID3KEW009;KEWPIE SALAD DRESSING SPICY TOMATO 6X1L;PPN_01;PPNM01
EID3KEW010;KEWPIE COOKING SAUCE CHEESE MAYO 6X1KG;PPN_01;PPNM01
EID3KEW011;KEWPIE COOKING SAUCE YOGHURT MAYO 6X1KG;PPN_01;PPNM01
EID3KEW012;KEWPIE COOKING SAUCE ROASTED SESAME MAYO 6X1KG;PPN_01;PPNM01
EID3KEW013;KEWPIE SUSHI SEASONING 14X600ML;PPN_01;PPNM01
EID3KEW014;KEWPIE MAYONNAISE ORIGINAL 2 X 12 X 150GR 3300501201;PPN_01;PPNM01
EID3KEW015;KEWPIE SAUS MAYO GURIH 2 X 12 X 150GR 3300501203;PPN_01;PPNM01
EID3KEW016;KEWPIE SALAD DRESSING ROASTED SESAME 12 X 200ML 3300502401;PPN_01;PPNM01
EID3KEW017;KEWPIE SALAD DRESSING SOY SAUCE 12 X 200ML 3300502402;PPN_01;PPNM01
EID3KEW018;KEWPIE SALAD DRESSING SPICY TOMATO 12 X 200ML 3300502403;PPN_01;PPNM01
EID3KEW019;KEWPIE SALAD DRESSING CAESAR 12 X 200ML 3300502404;PPN_01;PPNM01
EID3KEW020;KEWPIE SALAD DRESSING THOUSAND ISLAND 12 X 200ML 3300502405;PPN_01;PPNM01
EID3KEW021;KEWPIE ONION & MAYO 6 X 1 KG;PPN_01;PPNM01
EID3KEW022;KEWPIE MAYO PRO-USE 4 X 3KG;PPN_01;PPNM01
EID3KEW023;KEWPIE MAYONNAISE ORIGINAL 10 X 40 X 15GR 501101;PPN_01;PPNM01
EID3KEW024;KEWPIE SALAD DRESSING WIJEN 10 X 40 X 25ML 502101;PPN_01;PPNM01
EID3KEW025;KEWPIE SALAD DRESSING KECAP 10 X 40 X 25ML 502102;PPN_01;PPNM01
EID3KEW026;KEWPIE SALAD DRESSING TOMAT PEDAS 10 X 40 X 25ML 502103;PPN_01;PPNM01
EID3KEW027;KEWPIE SALAD DRESSING CAESAR 10 X 40 X 25ML 502104;PPN_01;PPNM01
EID3KEW028;KEWPIE SALAD DRESSING THOUSAND ISLAND 10 X 40 X 25ML 502105;PPN_01;PPNM01
EID3KEW029;KEWPIE NAKAJIMA SUISAN/NS SUSHI SEASONING 14X600ML;PPN_01;PPNM01
EID3KEW030;KEWPIE MAYO PRO-USE 6 X 1KG;PPN_01;PPNM01
EID3KEW031;KEWPIE CHEF STYLE MAYO 4 X 3 KG;PPN_01;PPNM01
EID3KEW032;KEWPIE TARTAR SAUCE 6 X 1L;PPN_01;PPNM_08
EID3KEW033;KEWPIE NANBAN SAUCE 6 X 1200GR;PPN_01;PPNM01
EID3KEW034;KEWPIE RICE IMPROVER 14X700GR;PPN_01;PPNM_08
EID3KEW035;KEWPIE COOKING SAUCE MENTAI MAYO 12X1KG;PPN_01;PPNM01
EID3KEW036;KEWPIE SUMMER SPICE SAUCE 12X1KG;PPN_01;PPNM_08
EID3KEW037;KEWPIE HONEY MUSTARD SAUCE 6 X 1KG;PPN_01;PPNM01
EID3KEW038;CANCEL;PPN_01;PPNM01
EID3KOK001;KOKA SEAFOOD FLAVOUR BOWL 12X90G;PPN_01;PPNM_08
EID3LOC001;TOKINORI SUSHI NORI : ROASTED SEAWEED 50 SHEETS/PACK;PPN_01;PPNM01
EID5BUL001;BERAS PREMIUM I 5 KG;PPNK_08;PPNM_08
EID5BUL002;BERAS PREMIUM I 1 KG;PPNK_08;PPNM_08
EID5BUL003;BERAS MERAH 1 KG;PPNK_08;PPNM_08
EID5BUL004;BERAS HITAM 1 KG;PPNK_08;PPNM_08
EID5BUL005;GULA MANIS KITA 1KG;PPNK_08;PPNM_08
EID5BUL006;TEPUNG TERIGU KITA 1 KG;PPNK_08;PPNM_08
EIT3BAL001;BALCONI CUBI WAFER CACAO (CHOCOLATE) 10X250GR;PPN_01;PPNM01
EIT3BAL002;BALCONI CUBI WAFER NOCCIOLA (HAZZELNUTS) 10X250GR;PPN_01;PPNM01
EIT3BAL003;BALCONI CUBI WAFER VANIGLIA (VANILLA) 10X250GR;PPN_01;PPNM01
EIT3BAL004;BALCONI WAFER CACAO (CHOCOLATE) 24X175GR;PPN_01;PPNM01
EIT3BAL005;BALCONI WAFER NOCCIOLA (HAZZELNUTS) 24X175GR;PPN_01;PPNM01
EIT3BAL006;BALCONI WAFER VANIGLIA (VANILLA) 24X175GR;PPN_01;PPNM01
EIT3BAL007;BALCONI CUBI WAFER NOCCIOLA (HAZZELNUTS) 18X125GR;PPN_01;PPNM01
EIT3BAL008;BALCONI CUBI WAFER CACAO (CHOCOLATE) 18X125GR;PPN_01;PPNM01
EIT3BAL009;BALCONI CUBI WAFER VANIGLIA (VANILLA) 18X125GR;PPN_01;PPNM01
EIT3CIA001;CIAO BAKED BEANS 24X400GR;PPN_01;PPNM01
EIT3CIA002;CIAO CHICK PEAS 26/28, 24X400GR;PPN_01;PPNM_08
EIT3CIA003;CIAO BAKED BEANS 6X2700GR;PPN_01;PPNM01
EIT3CIA004;CIAO LENTILS 24X400GR;PPN_01;PPNM01
EIT3CIA005;CIAO PEELED TOMATOES 6X2500 GR;PPN_01;PPNM01
EIT3CIA006;CIAO PEELED TOMATOES WITH BASIL 6X3000 GR;PPN_01;PPNM01
EIT3DEC001;DE CECCO PASSATA DI POMODORO RUSTICA PAR0986 12X700GR;PPN_01;PPNM01
EIT3DEC002;DE CECCO PASSATA DI POMODORO PA10985 12X700GR;PPN_01;PPNM01
EIT3DEC003;DE CECCO POLPA DI POMODORO NATURALE 12X690GR PP11975;PPN_01;PPNM01
EIT3DEC004;DE CECCO SUGO FACILE PSF0970 12X690GR;PPN_01;PPNM01
EIT3DEC005;DE CECCO FARINA DI GRANO TENERO TYPO '00' 10X1KG OFZT177;PPN_01;PPNM01
EIT3DEC006;DE CECCO SEMOLINO 24X250GR OLX1175;PPN_01;PPNM01
EIT3DEC007;DE CECCO PAPPARDELLE NIDI SEMOLA 10X500GR;PPN_01;PPNM01
EIT3DEC008;DE CECCO FETTUCCINE NIDI SEMOLA 10X500GR;PPN_01;PPNM01
EIT3DEC009;DE CECCO FILETTI DI POMODORO PF11991 12X400GR;PPN_01;PPNM01
EIT3DEC010;DE CECCO POLPA A PEZZETTONI PP12973 12X400GR;PPN_01;PPNM01
EIT3DEC011;DE CECCO SPAGHETTI PASTA KAMUT CEE 20X500GR OKA0012;PPN_01;PPNM01
EIT3DEC012;DE CECCO FUSILLI PASTA KAMUT CEE 12X500GR OKA1034;PPN_01;PPNM01
EIT3DEC013;DE CECCO TUBETTI RIGATI PASTA KAMUT CEE 12X500GR OKA1064;PPN_01;PPNM01
EIT3DEC014;DE CECCO FUSILLI PASTA ORGANIC/ BIOLOGICA CEE 12X500GR OBI10;PPN_01;PPNM01
EIT3DEC015;DE CECCO CAPELLINI OSX0009 24X500 GR 8001250120090;PPN_01;PPNM01
EIT3DEC016;DE CECCO CONCHIGLIE RIGATE OSXE050 24X500 GR 8001250120502;PPN_01;PPNM01
EIT3DEC017;DE CECCO SEMOLA DI GRANO DURO RIMACINATA 1X10 OFW0176;PPN_01;PPNM01
EIT3DEC018;DE CECCO FUSILLI OSXE034 24 X 500 GR 8001250120342;PPN_01;PPNM01
EIT3DEC019;DE CECCO LINGUINI OSXE007 24 X 500 GR 8001250120076;PPN_01;PPNM01
EIT3DEC020;DE CECCO PENNE RIGATE OSXE041 24X500 GR 8 001250120410;PPN_01;PPNM01
EIT3DEC021;DE CECCO RIGATONI OSXE024 24 X 500 GR 8001250120243;PPN_01;PPNM01
EIT3DEC022;DE CECCO SPAGHETTI OSXE012 24 X 500 GR 8001250120120;PPN_01;PPNM01
EIT3DEC023;DE CECCO TAGLIATELLE SPINACH 12 X 250 GR 8001250501073;PPN_01;PPNM01
EIT3DEC024;DE CECCO SPAGHETTINI OSXE011 24X500 8001250120113;PPN_01;PPNM01
EIT3DEC025;DE CECCO FARFALLE OSXE093 24 X 500 GR 8001250 120939;PPN_01;PPNM01
EIT3DEC026;DE CECCO EGG PAPPARDELLE OUN2101 12X250 GR 8001250201010;PPN_01;PPNM01
EIT3DEC027;DE CECCO EGG TAGLIERINI ALL UOVO NO.15 12X250GR;PPN_01;PPNM01
EIT3DEC028;DE CECCO ALFABETTO OSX0173 24/500 GR 8001250121738;PPN_01;PPNM01
EIT3DEC029;DE CECCO LASGN LARGA DOPPIA RICCA OSX2001 24X500GM 800125011;PPN_01;PPNM01
EIT3DEC030;DE CECCO EGG FETTUCCINE MATASS UOVO OUN2103 12X250;PPN_01;PPNM01
EIT3DEC031;DE CECCO TAGLIERINI MATASS UON2105 12X250 GM;PPN_01;PPNM01
EIT3DEC032;DE CECCO TAGLIAT SPINACH MATASS OUN2107 12X250 GM;PPN_01;PPNM01
EIT3DEC033;DE CECCO FARINA DI GRANO DURO OFS0161 10/1KG;PPN_01;PPNM01
EIT3DEC034;DE CECCO LASAGNA ALL'UOVO CON SPINACI 500GR 8001250511140;PPN_01;PPNM01
EIT3DEC035;DE CECCO SPAGHETTI  OSXF012  12X1KG;PPN_01;PPNM01
EIT3DEC036;DE CECCO LINGUINE  OSX4007 12X1 KG;PPN_01;PPNM_08
EIT3DEC037;DE CECCO SUGO ALLA SICILIANA 12X200GR;PPN_01;PPNM01
EIT3DEC038;DE CECCO PESTO ALLA GENOVESE CEE 12X200GR SE26919;PPN_01;PPNM01
EIT3DEC039;DE CECCO SUGO ALL'ARRABBIATA 12X200GR SG84914;PPN_01;PPNM01
EIT3DEC040;DE CECCO SUGO ALLA NAPOLETANA 12X200GR SG86916;PPN_01;PPNM01
EIT3DEC041;DE CECCO SUGO ALLA SICILIANA 6X400GR 5SG3913;PPN_01;PPNM01
EIT3DEC042;DE CECCO SUGO ALL'ARRABBIATA 6X400GR 5SG4914;PPN_01;PPNM01
EIT3DEC043;DE CECCO SUGO ALLA NAPOLETANA 6X400GR 5SG6916;PPN_01;PPNM01
EIT3DEC044;DE CECCO SPAGHETTI OSI1012 20X500GR;PPN_01;PPNM01
EIT3DEC045;DE CECCO PENNE RIGATE OSI1041 12X500GR;PPN_01;PPNM01
EIT3DEC046;DE CECCO CAPELLI D'ANGELO NIDI SEMOLA OSW0209 10X500GR;PPN_01;PPNM01
EIT3DEC047;DE CECCO SPAGHETTI WHOLE WHEAT INTEGRALI 12X500GR;PPN_01;PPNM_08
EIT3DEC048;DE CECCO PENNE RIGATE INTEGRALI 12X500GR;PPN_01;PPNM_08
EIT3DEC049;DE CECCO CAPELLI D'ANGELO NIDI SEMOLA OSW4209 8X500GR;PPN_01;PPNM_08
EIT3DEC050;DE CECCO PAPPARDELLE NIDI SEMOLA 8X500GR;PPN_01;PPNM01
EIT3DEC051;DE CECCO MACCHERONI CHITARRA QSX0013 24X500GR;PPN_01;PPNM_08
EIT3DEC052;DE CECCO MACCHERONI QSX0122 24X500GR;PPN_01;PPNM_08
EIT3DEC053;DE CECCO LUMACONI RIGATI OSX3123 24X500GR;PPN_01;PPNM_08
EIT3DEC054;DE CECCO RIGATONI NAPOLETANI OSX3124 24X500GR;PPN_01;PPNM_08
EIT3DEC055;DE CECCO PACCHERI OSX3125 24X500GR;PPN_01;PPNM_08
EIT3DEC056;DE CECCO PACCHERI RIGATI OSX3130 24X500GR;PPN_01;PPNM_08
EIT3DEC057;DE CECCO BUCATINI QSXE015 24X500GR;PPN_01;PPNM_08
EIT3DEC058;DE CECCO CASARECCIA QSXE088 24X500GR;PPN_01;PPNM_08
EIT3DEC059;DE CECCO ORECCHIETTE QSXE091 24X500GR;PPN_01;PPNM_08
EIT3DEC060;DE CECCO SPAGHETTONI QSXE412 24X500GR;PPN_01;PPNM_08
EIT3GFL001;GAROFALO LUMACHINE 16X500GR;PPN_01;PPNM01
EIT3GFL002;GAROFALO SPAGHETTI LUNGHI 20X500GR;PPN_01;PPNM01
EIT3GFL003;GAROFALO CAPELLINI 24x500gr 8000139000287;PPN_01;PPNM01
EIT3GFL004;GAROFALO CAPPELLETTI 16x500gr 8000139910210;PPN_01;PPNM01
EIT3GFL005;GAROFALO FUSILLI 16x500gr 8000139910227;PPN_01;PPNM01
EIT3GFL006;GAROFALO FARFALLE 16x500gr 8000139910241;PPN_01;PPNM01
EIT3GFL007;GAROFALO GEMELLI 16x500gr;PPN_01;PPNM01
EIT3GFL008;GAROFALO GNOCCHI SARDI 16x500gr 8000139910203;PPN_01;PPNM01
EIT3GFL009;GAROFALO LINGUINE 24x500gr 8000139910159;PPN_01;PPNM01
EIT3GFL010;GAROFALO MAFALDA CORTA 16x500gr 8000139910258;PPN_01;PPNM01
EIT3GFL011;GAROFALO PAPPARDELLE NIDO 12x500gr 8000139910272;PPN_01;PPNM01
EIT3GFL012;GAROFALO PENNE ZITI RIGATE 16x500gr 8000139910234;PPN_01;PPNM01
EIT3GFL013;GAROFALO RIGATONI 16x500gr 8000139910197;PPN_01;PPNM01
EIT3GFL014;GAROFALO RADIATORI 16x500gr 8000139910265;PPN_01;PPNM01
EIT3GFL015;GAROFALO SPAGHETTINI 24x500gr 8000139910319;PPN_01;PPNM01
EIT3GFL016;GAROFALO SPAGHETTI 24x500gr 8000139910142;PPN_01;PPNM01
EIT3GFL017;GAROFALO TAGLIATELLE NIDO 12x500gr 8000139910289;PPN_01;PPNM01
EIT3GFL018;GAROFALO TAGLIATELLE NIDO PRIMA 12x500gr 8000139910388;PPN_01;PPNM01
EIT3GFL019;GAROFALO PAZZIELLE 16X500 GR 8000139910074;PPN_01;PPNM01
EIT3GFL020;GAROFALO MOTORI  16X500 GR 8000139910050;PPN_01;PPNM01
EIT3GFL021;GAROFALO ANISTELLE 16X500 GR 8000139910081;PPN_01;PPNM01
EIT3GFL022;GAROFALO DISCHI VOLANTI 16X500 GR 8000139910067;PPN_01;PPNM01
EIT3GFL023;GAROFALO MULTIPACK LA GIOSTRA 12X4X125 GR 8000139910104;PPN_01;PPNM01
EIT3GFL024;GAROFALO PRIMAVERA 16X500 GR 8000139910371;PPN_01;PPNM01
EIT3GFL025;GAROFALO LASAGNA 20X500 GR 8000139910852;PPN_01;PPNM01
EIT3GFL026;GAROFALO FETTUCCE 24X500 GR 8000139910432;PPN_01;PPNM01
EIT3GFL027;GAROFALO CASARECCE 16X500 GR 8000139910753;PPN_01;PPNM01
EIT3GFL028;GAROFALO PENNE MEZZANELLI 16X500 GR 8000139001741;PPN_01;PPNM01
EIT3GFL029;GAROFALO MEZZE MANICHE RIGATE 16X500 GR 8000139007095;PPN_01;PPNM01
EIT3GFL030;GAROFALO SPAGHETTI GLUTEN FREE GR0F 12X500 L7100S;PPN_01;PPNM_08
EIT3GFL031;GAROFALO PENNE RIGATE GLUTEN FREE GR0F 12X500 L7024S;PPN_01;PPNM_08
EIT3GFL032;GAROFALO SPAGHETTI GLUTEN FREE GR0F 15X400GR L9157;PPN_01;PPNM_08
EIT3GFL033;GAROFALO LASAGNA 12X500 GR L9102D;PPN_01;PPNM_08
EIT3GFL034;GAROFALO PENNE RIGATE GLUTEN FREE 12X400GR L9105;PPN_01;PPNM_08
EJP2NHF001;Japanese Stock (Chicken) Soup KG30AK  1kgx10;PPN_01;PPNM_08
EKR3BAN001;BAN-DARAN SWEET PUMPKIN PORRIDGE 7 X 130GR X 6 INNER BOX;PPN_01;PPNM01
EKR3BAN002;BAN-DARAN NUTS PORRIDGE 7 X 130GR X 6 INNER BOX;PPN_01;PPNM01
EKR3BAN003;BAN-DARAN BLACK SESAME PORRIDGE 7 X 130GR X 6 INNER BOX;PPN_01;PPNM01
EKR3BAN004;BAN-DARAN SWEET RED BEAN PORRIDGE 7 X 130GR X 6 INNER BOX;PPN_01;PPNM01
EKR3BAN005;BAN-DARAN SWEET PUMPKIN PORRIDGE 42 X 130GR;PPN_01;PPNM01
EKR3BAN006;BAN-DARAN NUTS PORRIDGE 42 X 130GR;PPN_01;PPNM01
EKR3BAN007;BAN-DARAN BLACK SESAME PORRIDGE 42 X 130GR;PPN_01;PPNM01
EKR3BAN008;BAN-DARAN SWEET RED BEAN PORRIDGE 42 X 130GR;PPN_01;PPNM01
EKR3MAT001;MATAMUN EASY JAPCHAE 20 X 160GR  8809054 400185;PPN_01;PPNM_08
EKR3NUT001;NUTS HOLIC HONEY BUTTER ALMOND 20X180G;PPN_01;PPNM_08
EKR3NUT002;NUTS HOLIC HOT & SPICY CHICKEN ALMOND 20X180G;PPN_01;PPNM_08
EKR3NUT003;NUTS HOLIC STRAWBERRY ALMOND 20X180G;PPN_01;PPNM_08
EKR3NUT004;NUTS HOLIC HONEY BUTTER ALMOND 8X20X30G;PPN_01;PPNM_08
EKR3NUT005;NUTS HOLIC HOT & SPICY CHICKEN ALMOND 8X20X30G;PPN_01;PPNM_08
EKR3NUT006;NUTS HOLIC STRAWBERRY ALMOND 8X20X30G;PPN_01;PPNM_08
EKR3NUT007;NUTS HOLIC BANANA ALMOND 20X180G;PPN_01;PPNM01
EKR3NUT008;NUTS HOLIC WASABI ALMOND 20X180G;PPN_01;PPNM01
EKR3NUT009;NUTS HOLIC KIMCHI ALMOND 20X180G;PPN_01;PPNM01
EKR3NUT010;NUTS HOLIC WASABI ALMOND 8X20X30G;PPN_01;PPNM01
EKR3NUT011;NUTS HOLIC BANANA ALMOND 8X20X30G;PPN_01;PPNM01
EKR3NUT012;NUTS HOLIC KIMCHI ALMOND 8X20X25G;PPN_01;PPNM01
EKR3POR001;PORORO ALMOND FLAKES 12X310GR;PPN_01;PPNM_08
EKR3POR002;PORORO CORN PLEASURE 12X310GR;PPN_01;PPNM_08
EKR3POR003;PORORO FIVE GRAINS CHOCOROPIN 12X220GR;PPN_01;PPNM_08
EKR3POR004;PORORO FIVE GRAINS CHOCOROPIN 12X520GR;PPN_01;PPNM_08
EKR3RAO001;SPOONZ ICE CONE SNACK CHOCOLATE 40X27GR;PPN_01;PPNM_08
EKR3RAO002;SPOONZ ICE CONE SNACK STRAWBERRY 40X27GR;PPN_01;PPNM_08
EKR3RAO003;SPOONZ ICE CONE SNACK BANANA 40X27GR;PPN_01;PPNM_08
EKR3YOP001;YOPOKKI SPICY POUCH 20 X 140GR  8809054 409126;PPN_01;PPNM_08
EKR3YOP002;YOPOKKI HALAL ORIGINAL TOPOKKI CUP 30 X 140GR;PPN_01;PPNM_08
EKR3YOP003;YOPOKKI HALAL ORIGINAL TOPOKKI POUCH 24 X 280GR;PPN_01;PPNM_08
EKR3YOP004;YOPOKKI HALAL JJAJANG TOPOKKI CUP 30 X 140GR;PPN_01;PPNM_08
EKR3YOP005;YOPOKKI HALAL JJAJANG TOPOKKI POUCH 24 X 280GR;PPN_01;PPNM_08
EKR3YOP006;YOPOKKI HALAL SPICY TOPOKKI CUP 30 X 140GR;PPN_01;PPNM_08
EKR3YOP007;YOPOKKI HALAL SPICY TOPOKKI POUCH 24 X 280GR;PPN_01;PPNM_08
ENZ3CHR001;CHARLIES MANGO WHOLE FRUIT SMOOTHIE 300ML;PPN_01;PPNM_08
ENZ3TAY001;Halal Beef Shortening 18 Kg;PPN_01;PPNM01
ENZ3TAY002;Halal Beef Shortening 3 Kg;PPN_01;PPNM01
ESG1BEL001;BELUGA SWISS CAVIAR 100 GR;PPN_01;PPNM01
ESG1IND001;FRESH/FROZEN MISC;PPN_01;PPNM01
ESG1IND002;FRESH/FROZEN MISC;PPN_01;PPNM01
ESG1IND003;FRESH AUTUMN TRUFFLE;PPNK_08;PPNM01
ESG1IND004;AVRUGA/ HERRING SPAIN CAVIAR  350 GR;PPN_01;PPNM01
ESG2CHO001;FRESH SUMMER TRUFFLE;PPNK_08;PPNM01
ESG2IGS001;ACTIVA POWDER;PPN_01;PPNM01
ESG2IND001;WOODCHIPS GOLDEN SMOKED KL 25 KG;PPN_01;PPNM01
ESG2IND002;FROZEN LUMP CRAB CLAW MEAT  12tubx1lb;PPN_01;PPNM01
ESG2IND003;FROZEN CRAB CLAW MEAT UPGRADE 12tubx1lb;PPN_01;PPNM01
ESG2IND004;FROZEN MEATBALL 50 PCS/PKT;PPN_01;PPNM01
ESG2KOK001;KOKA BLACK PEPPER FLAVOUR 30X85G;PPN_01;PPNM_08
ESG3IGS001;ELDERFLOWER;PPN_01;PPNM_08
ESG3IGU001;BEECH WOOD CHIP;PPN_01;PPNM01
ESG3IND001;KALUGA QUEEN BAERI CAVIAR 100 GR;PPN_01;PPNM01
ESG3IND002;AVRUGA CAVIAR 55 GM;PPN_01;PPNM01
ESG3KOK001;KOKA CHICKEN ORIGINAL FLAVOUR 30X85G;PPN_01;PPNM01
ESG3KOK002;KOKA CURRY FLAVOUR 30X85G;PPN_01;PPNM01
ESG3KOK003;KOKA MUSHROOM FLAVOUR 30X85G;PPN_01;PPNM_08
ESG3KOK004;KOKA PEPPER CRAB FLAVOUR 30X85G;PPN_01;PPNM_08
ESG3KOK005;KOKA SPICY S'PORE FRIED FLAVOUR 30X85G;PPN_01;PPNM_08
ESG3KOK006;KOKA ORIGINAL STIR FRIED FLAVOUR 30X85G;PPN_01;PPNM_08
ESG3KOK007;KOKA TOM YAM FLAVOUR 30X85G;PPN_01;PPNM_08
ESG3KOK008;KOKA VEGETARIAN CURRY FLAVOUR 24X85G;PPN_01;PPNM_08
ESG3KOK009;KOKA SPICY BLACK PEPPER FLAVOUR 24X85G;PPN_01;PPNM_08
ESG3KOK010;KOKA SPICY SESAME FLAVOUR 24X85G;PPN_01;PPNM_08
ESG3KOK011;KOKA TOMATO FLAVOUR 24X85G;PPN_01;PPNM01
ESG3KOK012;KOKA CHICKEN PHO FLAVOUR 20X70G;PPN_01;PPNM01
ESG3KOK013;KOKA TOM YAM FLAVOUR 20X70G;PPN_01;PPNM_08
ESG3KOK014;KOKA SEAFOOD FLAVOUR RICE NOODLE 20X70G;PPN_01;PPNM01
ESG3KOK015;KOKA CURRY CREAMY SOUP CUP 12X60G;PPN_01;PPNM01
ESG3KOK016;KOKA CHICKEN ORIGINAL BOWL 12X90G;PPN_01;PPNM01
ESG3KOK017;KOKA LAKSA SINGAPURA BOWL 12X90G;PPN_01;PPNM01
ESG3KOK018;KOKA TOM YAM BOWL 12X90G;PPN_01;PPNM01
ESG3KOK019;KOKA CHICKEN SATAY 30X85G;PPN_01;PPNM01
ESG3KOK020;KOKA LAKSA SINGAPURA 30X90G;PPN_01;PPNM01
ESG3KOK021;KOKA LAKSA SINGAPURA 24X85G;PPN_01;PPNM01
ESG3KOK022;KOKA CHICKEN ABALONE BOWL RICE NOODLE 12X70G;PPN_01;PPNM01
ESG3KOK023;KOKA LAKSA SINGAPURA BOWL RICE NOODLE 12X70G;PPN_01;PPNM01
ESG3KOK024;KOKA PURPLE WHEAT AGLIO OLIO 30X60GR;PPN_01;PPNM01
ESG3KOK025;KOKA PURPLE WHEAT CHILI & LIME 30X60GR;PPN_01;PPNM01
ESG3KOK026;KOKA PURPLE WHEAT SOY & VINEGAR 30X60GR;PPN_01;PPNM01
ESG3KOK027;KOKA CHICKEN CREAMY SOUP CUP 12X60GR;PPN_01;PPNM01
ESG3KOK028;KOKA HOT & SOUR CREAMY SOUP CUP 12X60GR;PPN_01;PPNM01
ESG3KOK029;KOKA PURPLE WHEAT BRAISED DUCK 30X65GR;PPN_01;PPNM01
ESG3KOK030;KOKA SPICY MARINARA BOWL RICE NOODLE 12X70G;PPN_01;PPNM01
ESG3KOK031;KOKA SWEET CORN CREAMY SOUP CUP 12X60G;PPN_01;PPNM01
ESG3KOK032;KOKA MUSHROOM CREAMY SOUP CUP 12X60G;PPN_01;PPNM01
ESG3KOK033;KOKA VEGETABLE CREAMY SOUP CUP 12X60G;PPN_01;PPNM01
ESG3KOK034;KOKA MULTIGRAIN PURPLE FIVE SPICED DUCK CUP 12X65G;PPN_01;PPNM_08
ESG3KOK035;KOKA MULTIGRAIN PURPLE HOT MALA TOFU CUP 12X65G;PPN_01;PPNM_08
ESG3KOK036;KOKA MULTIGRAIN PURPLE PEPPER CRAB CUP 12X65G;PPN_01;PPNM_08
ESG4IND001;FRESH WINTER TRUFFLE;PPN_01;PPNM01
EUS2FAR001;FARMLAND BACON BELLY SLICED SILVER MEDAL 15 LB;PPN_01;PPNM01
EUS2FAR002;FARMLAND PORK TENDERLOIN VP14650,14616,14780;PPNK_08;PPNM_08
EUS2FAR003;FARMLAND ZIP HONEYTURKEY BREAST 16/10 OZ 070247 830449;PPN_01;PPNM01
EUS2HOR001;HORMEL LAYOUT BACON FILLET BLUE LABEL 20lb;PPN_01;PPNM01
EUS2LOL001;Frz US Butter 25kg;PPN_01;PPNM_01
EUS2MRA001;M/RANCHO FLOUR TORTILAS MED 10  604;PPN_01;PPNM_01
EUS2SYS001;Garden Burger Org. Veggie Patties 48/3.4oz;PPN_01;PPNM_01
EUS3CMB001;CAMPBELLS CHICKEN NOODLE 48/10.75 OZ 051000012517;PPN_01;PPNM_01
EUS3FLI001;LOC LIQUID SMOKED 1LTR;PPN_01;PPNM01
EUS3GER001;Geraldine Tuscan Rosemary Cheese Straws 12/4.5oz;PPN_01;PPNM_08
EUS3WRP001;W/ROSE WHOLE KERNEL SWEET CORN 24/15 OZ 074807 452485;PPN_01;PPNM_01
FAU4IGS001;KALUGA QUEEN SCHRENCKII CAVIAR 100GR;PPN_01;PPNM_08
FDE3HTB001;H. MIXED PICKLES 6X370ML;PPN_01;PPNM01
FDE3HTB002;H. GHERKIN 75/80  2x10.2 lt/tin;PPN_01;PPNM01
FDE3HTB003;H. CORNICHONS COCKTAIL 4X2650ML 4008100 142306;PPN_01;PPNM01
FDE3HTB004;H. GHERKINS 3X2650ML;PPN_01;PPNM01
FDE3HTB005;H. MIXED PICKLES 3X2650ML 4008100 170308;PPN_01;PPNM01
FDE3HTB006;H. CORNICHON COCKTAIL 12X370ML 4008 1731;PPN_01;PPNM01
FDE3HTB007;H. GHERKIN  12X370ML 038274 435242;PPN_01;PPNM01
FDE3HTB008;H. MILDESSA WINE  SAUERKRAUT 3X2650ML/2530GR  4008100150959;PPN_01;PPNM01
FDE3HTB009;H. CORNICHON COCKTAIL  3X2650ML 4008100 172302;PPN_01;PPNM01
FDE3HTB010;H. SANDWICHED GHERKINS SLICED 6 X 370GR;PPN_01;PPNM_08
FES1PES001;PESCAVIAR AVRUGA 120 GR;PPN_01;PPNM_08
FES1PES002;PESCAVIAR AVRUGA 350 GR;PPN_01;PPNM_08
FES1PES003;PESCAVIAR AVRUGA 900GR;PPN_01;PPNM_08
FES1PES004;PESCAVIAR AVRUGA 55GR;PPN_01;PPNM_08
FES3LAR001;LA RAMBLA EXTRA LIGHT OLIVE OIL 12X500ML 8433260301327;PPN_01;PPNM01
FES3LAR002;La Rambla Extra Light Olive Oil 12x1 lt 8433260301303;PPN_01;PPNM01
FES3LAR003;LA RAMBLA GRAPESEED OIL 12X500ML 8433260601328;PPN_01;PPNM01
FES3LAR004;LA RAMBLA GRAPESEED OIL 6X1LT 8433260601304;PPN_01;PPNM01
FES3LAR005;LA RAMBLA GREEN OLIVE STUFFED W/ NATURAL ANCHOVY 12X235GR 8433260504001;PPN_01;PPNM01
FES3LAR006;LA RAMBLA EXTRA VIRGIN OLIVE OIL 3X3LT 8433260101026;PPN_01;PPNM01
FES3LAR007;LA RAMBLA MANZANILLA GREEN OLIVES (WHOLE) 12X235G 8433260501000;PPN_01;PPNM01
FES3LAR008;LA RAMBLA GREEN PITTED OLIVES 6X3KG 8433260502014;PPN_01;PPNM01
FES3LAR009;LA RAMBLA OLIVE OIL 100% PURE 6X1LT 8433260201306;PPN_01;PPNM01
FES3LAR010;LA RAMBLA BALSAMICO DI MODENA VINEGAR 12X250ML 8433260405339;PPN_01;PPNM01
FES3LAR011;LA RAMBLA EXTRA LIGHT OLIVE OIL 6X1LT 8433260301303;PPN_01;PPNM01
FES3LAR012;LA RAMBLA APPLE VINEGAR 12X250ML 8433260403335;PPN_01;PPNM01
FES3LAR013;LA RAMBLA EXTRA LIGHT OLIVE OIL 12X500ML 8433260301327;PPN_01;PPNM01
FES3LAR014;LA RAMBLA RED WINE VINEGAR 3X5LT 8433260401003;PPN_01;PPNM01
FES3LAR015;LA RAMBLA BALSAMICO DI MODENA VINEGAR 3X5LT 8433260405001;PPN_01;PPNM01
FES3LAR016;LA RAMBLA NATURAL ARTICHOKES 12X415G 8433260702001;PPN_01;PPNM01
FES3LAR017;LA RAMBLA EXTRA VIRGIN OLIVE OIL 12X250ML 8433260101330;PPN_01;PPNM01
FES3LAR018;LA RAMBLA EXTRA VIRGIN OLIVE OIL 12X500ML 8433260101323;PPN_01;PPNM01
FES3LAR019;LA RAMBLA EXTRA VIRGIN OLIVE OIL 3X5LT 8433260101002;PPN_01;PPNM01
FES3LAR020;LA RAMBLA OLIVE OIL 100% PURE 12X500ML 8433260201320;PPN_01;PPNM01
FES3LAR021;LA RAMBLA OLIVE OIL 100% PURE 12X1LT 8433260201306;PPN_01;PPNM01
FES3LAR022;LA RAMBLA NATOLEA OLIVE POMACE OIL 3X5LT 8433260990019;PPN_01;PPNM01
FES3LAR023;LA RAMBLA MANZANILLA GREEN PITTED OLIVES 12X235G 8433260502007;PPN_01;PPNM01
FES3LAR024;LA RAMBLA BLACK PITTED OLIVES 12X235G 8433260503004;PPN_01;PPNM01
FES3LAR025;LA RAMBLA OLIVE OIL 100% PURE 3X5LT 8433260201009;PPN_01;PPNM01
FES3LAR026;LA RAMBLA EXTRA VIRGIN OLIVE OIL ARBEQUINA 6X500ML 8433260102320;PPN_01;PPNM01
FES3LAR027;LA RAMBLA EXTRA VIRGIN OLIVE OIL CORNICABRA 6X500ML 8433260103327;PPN_01;PPNM01
FES3LAR028;LA RAMBLA EXTRA VIRGIN OLIVE OIL PICUAL 6X500ML 843326010432;PPN_01;PPNM01
FES3LAR029;LA RAMBLA GREEN OLIVES STUFFED W/ NATURAL PIMENTO 12X235G 8433260505008;PPN_01;PPNM01
FES3LAR030;LA RAMBLA BLACK PITTED OLIVES 6X3KG 8433260503011;PPN_01;PPNM01
FES3LAR031;LA RAMBLA MARINATED ARTICHOKES 12X415G;PPN_01;PPNM01
FES3LAR032;LA RAMBLA EXTRA VIRGIN OLIVE OIL 280X20ML;PPN_01;PPNM01
FES3LAR033;LA RAMBLA SHERRY VINEGAR 12X250ML;PPN_01;PPNM01
FES3LAR034;LA RAMBLA EXTRA VIRGIN OLIVE OIL ORGANIC 6x500ML;PPN_01;PPNM01
FES3LAR035;LA RAMBLA EXTRA VIRGIN OLIVE OIL 6X1LT;PPN_01;PPNM01
FES3LAR036;LA RAMBLA APPLE VINEGAR 12X500ML;PPN_01;PPNM01
FES3LAR037;LA RAMBLA BALSAMICO DI MODENA GLAZE 12X250GR;PPN_01;PPNM01
FES3LAR038;LA RAMBLA VINAIGRETTE EV + BALSAMICO DI MODENA 12X250ML;PPN_01;PPNM01
FES3LAR039;LA RAMBLA QUEEN PITTED OLIVE 12X235GR;PPN_01;PPNM01
FES3LAR040;LA RAMBLA ARBEQUINA OLIVES 12X370GR;PPN_01;PPNM01
FES3LAR041;LA RAMBLA BLACK SLICED OLIVE 6X3KG;PPN_01;PPNM01
FES3LAR042;LA RAMBLA PREMIUM COCKTAIL ONIONS 12X345GR;PPN_01;PPNM01
FES3LAR043;LA RAMBLA LEMON JUICE 24X280ML;PPN_01;PPNM01
FES3LAR044;LA RAMBLA BLACK SLICED OLIVES 12X235GR;PPN_01;PPNM01
FES3LAR045;LA RAMBLA NONPARAILLES CAPERS 12X100GR;PPN_01;PPNM01
FES3LAR046;LA RAMBLA GRILLED ARTICHOKES 12X400GR;PPN_01;PPNM01
FES3LAR047;LA RAMBLA ORGANIC UNFILTERED APPLE VINEGAR 12X500ML;PPN_01;PPNM_08
FES3MSP001;MSP BALSAMICO VINEGAR 500ML;PPN_01;PPNM01
FFR3BRD001;BRD PORCINI POWDER 130GR;PPN_01;PPNM01
FFR3BRD002;BRD PORCINI POWDER 160GR;PPN_01;PPNM01
FFR3FAL001;FALLOT DIJOT MUSTARD 1KG;PPN_01;PPNM_08
FFR3FAL002;FALLOT MUSTARD EN GRAIN 1KG;PPN_01;PPNM01
FFR3FAL003;FALLOT DIJON MUSTARD 1KG;PPN_01;PPNM01
FFR3FAL004;FALLOT EXTRA FINE GHERKINS 21CL;PPN_01;PPNM01
FID3BUL001;MINYAK GORENG KUNCI MAS 12 X 900ML;PPNK_08;PPNM_08
FID3BUL002;MINYAK GORENG KITA 1 L;PPNK_08;PPNM_08
FID3CIA001;CIAO RED KIDNEY BEANS 24X400GR;PPN_01;PPNM_08
