U_OldCode;CardName;CardType;CardFName;Type;Series;GroupCode;CreditLimit;U_locktimeout;FederalTaxID;MailAddress;Outlet;Address;Delivery Route
A102.024;SOLARIA HARTONO MALL;cCustomer;SOLARIA HARTONO MALL;Restaurant;803;102;25000000;30;31.661.126.8-526.000;JLN. ABDURRAHMAN SALEH NO. 1 BANJARSARI SOLO(SEBELAH SELATAN PATUNG AHMAD YANI);CV. SOCIAL KITCHEN, DINING LOUNGE & BAR;JLN. ABDURRAHMAN SALEH NO. 1 BANJARSARI SOLO(SEBELAH SELATAN PATUNG AHMAD YANI);
A102.273;TJEMAL TJEMIL;cCustomer;TJEMAL TJEMIL;Restaurant;803;102;5000000;0;90.210.342.3-526.000;Jl. Urip Sumoharjo RT 003 RW 002Purwoningratan JebresSurakarta;CV. THE BARRREL;Jl. Urip Sumoharjo RT 003 RW 002Purwoningratan JebresSurakarta;
A115.013;MARAKEZ;cCustomer;MARAKEZ;Restaurant;803;102;5000000;14;42.020.350.7-525.000;Jl. Dewi Sartika 33 Tegalklaten Klaten Kec. Klaten Tengah Kabupaten Klaten;CV. TIGA PILLAR SEJATI;Jl. Dewi Sartika 33 Tegalklaten Klaten Kec. Klaten Tengah Kabupaten Klaten;
A102.076;METRO (CV. METRO);cCustomer;CV. METRO;Restaurant;803;102;10000000;60;73.677.673.3-526.001;JL.KEBANGKITAN NASIONAL NO.45RT.001 RW.001 SRIWEDARI LAWEYAN;CV.JOGJA BOGA UTAMA;JL.KEBANGKITAN NASIONAL NO.45RT.001 RW.001 SRIWEDARI LAWEYAN;
A102.061;D'COLONELS;cCustomer;D'COLONELS;Restaurant;803;102;0;0;89.944.455.8-039.000;Jalan Honggowongso No.30 B, Kemlayan, Serengan, Sriwedari, Laweyan, Kota Surakarta, Jawa Tengah 57141;D'CAPELLO RESTO;Jalan Honggowongso No.30 B, Kemlayan, Serengan, Sriwedari, Laweyan, Kota Surakarta, Jawa Tengah 57141;
A102.048;DD PANTRY;cCustomer;DD PANTRY;Restaurant;803;102;0;7;0.0000.00000.00000.;Ps. Kliwon, Kec. Ps. Kliwon, Kota Surakarta, Jawa Tengah;D'COFFE CLUB SOLO;Ps. Kliwon, Kec. Ps. Kliwon, Kota Surakarta, Jawa Tengah;
A102.08;DYNASTI WANG RESTAURANT;cCustomer;DYNASTI WANG RESTAURANT;Restaurant;803;102;10000000;0;0.0000.00000.00000.;Jl. Bhayangkara No.9, Sriwedari, Laweyan, Kota Surakarta,;D'STADION;Jl. Bhayangkara No.9, Sriwedari, Laweyan, Kota Surakarta,;
A102.009;DALI GELATO UMS;cCustomer;DALI GELATO UMS;Restaurant;803;102;1000000;14;0.0000.00000.00000.;JLN. RADJIMAN NO.402SOLO;DAEGU;JLN. RADJIMAN NO.402SOLO;
A102.081;DALLAS RESTO (CV. METRO);cCustomer;CV. METRO;Restaurant;803;102;20000000;0;0.0000.00000.00000.;Jl. Kebangkitan Nasional No.56, Kota Surakarta, Jawa Tengah 57141;DAINTY KITCHEN;Jl. Kebangkitan Nasional No.56, Kota Surakarta, Jawa Tengah 57141;
A102.083;DAPUR CAKU-CAKU;cCustomer;DAPUR CAKU-CAKU;Restaurant;803;102;5000000;0;0.0000.00000.00000.;Jalan Garuda Mas No. 12 Karangasem Mendungan Pabelan Kartasura Sukoharjo;DALI GELATO;Jalan Garuda Mas No. 12 Karangasem Mendungan Pabelan Kartasura Sukoharjo;
A102.01;DBROTHER;cCustomer;DBROTHER;Restaurant;803;102;1000000;0;0.0000.00000.00000.;JETAK RT 02 RW 08 DAGEN JATEN KARANGANYAR (TIMUR LAMPU MERAH YONIF 413 SAMBERNYAWA);DAPUR CAKU-CAKU;JETAK RT 02 RW 08 DAGEN JATEN KARANGANYAR (TIMUR LAMPU MERAH YONIF 413 SAMBERNYAWA);
A102.088;D'CAPELLO RESTO;cCustomer;D'CAPELLO RESTO;Restaurant;803;102;2000000;0;55.737.960.9-526.000;Jalan Dokter Radjiman No.395, Bumi, Laweyan, Panularan, Kec. Laweyan, Kota Surakarta, Jawa Tengah;DAVE'S STEAK HOUSE;Jalan Dokter Radjiman No.395, Bumi, Laweyan, Panularan, Kec. Laweyan, Kota Surakarta, Jawa Tengah;
A102.235;DE PARISHA RESTAURANT;cCustomer;DE PARISHA RESTAURANT;Restaurant;803;102;500000;0;0.0000.00000.00000.;Jl. Duwet No.47Masjid Assalam-Belakang UMSKarangasem Solo;DD PANTRY;Jl. Duwet No.47Masjid Assalam-Belakang UMSKarangasem Solo;
A102.105;GRAINS & DOUGHT;cCustomer;GRAINS & DOUGHT;Restaurant;803;102;5000000;0;0.0000.00000.00000.;"Jl. Thamrin No.33 
 Gremet, Manahan - Solo";DE PARIS;"Jl. Thamrin No.33 
 Gremet, Manahan - Solo";
A102.073;DE SOLO;cCustomer;DE SOLO;Restaurant;803;102;300000;0;0.0000.00000.00000.;JLN. KEBALEN NO.2, BTPN RADIO LT. 1SOLO;DE PARISHA;JLN. KEBALEN NO.2, BTPN RADIO LT. 1SOLO;
A102.339;DIAMOND RESTO (CV. DIAMOND);cCustomer;CV. DIAMOND;Restaurant;803;102;10000000;60;74.814.731.1-526.000;Singosaren RT 003/003, Kemlayan, SerenganAyam Goreng Sor Pelem, Belakang Matahari Singosaren;DEVORA DIARY;Singosaren RT 003/003, Kemlayan, SerenganAyam Goreng Sor Pelem, Belakang Matahari Singosaren;
A102.127;D'JAVA RESTO;cCustomer;D'JAVA RESTO;Restaurant;803;102;300000;30;66.752.496.1-432.000;JLN.PROF DR.SUPOMO NO 99 MANGKUBUMEN BANJARSARI SOLO;DHAMA;JLN.PROF DR.SUPOMO NO 99 MANGKUBUMEN BANJARSARI SOLO;
A102.078;D'LIVING RESTAURANT;cCustomer;D'LIVING RESTAURANT;Restaurant;803;102;5000000;0;31.238.003.3-526.000;Slamet Riyadi St No.392, Purwosari, Laweyan, Surakarta City, Central Java 57144;DIAMOND RESTO (CV. DIAMOND);Slamet Riyadi St No.392, Purwosari, Laweyan, Surakarta City, Central Java 57144;
A102.077;DOUBLE DECKER RESTAURANT;cCustomer;DOUBLE DECKER RESTAURANT;Restaurant;803;102;10000000;7;0.0000.00000.00000.;Jalan Doktor Sutomo No. 20, Sriwedari, Laweyan, Kota Surakarta, Jawa Tengah 57141 (KARONSHI BELOK KIRI);DOBUTZO;Jalan Doktor Sutomo No. 20, Sriwedari, Laweyan, Kota Surakarta, Jawa Tengah 57141 (KARONSHI BELOK KIRI);
A102.084;DREAMT PHOTOGRAPHY;cCustomer;DREAMT PHOTOGRAPHY;Restaurant;803;102;1000000;30;0.0000.00000.00000.;JL. JAJAR JALAN DUKU II NO 10 LAWEYAN (DERETAN BATIK SENGENGE);DON COFFE;JL. JAJAR JALAN DUKU II NO 10 LAWEYAN (DERETAN BATIK SENGENGE);
A102.079;D'S DINNER CAFE & RESTO;cCustomer;D'S DINNER CAFE & RESTO;Restaurant;803;102;5000000;30;0.0000.00000.00000.;Jalan Ir. Soekarno (ground floor fave Hotel), Solo Baru, Madegondo, Grogol, Kabupaten Sukoharjo, Jawa Tengah;DOUBLE DECKER Restaurant;Jalan Ir. Soekarno (ground floor fave Hotel), Solo Baru, Madegondo, Grogol, Kabupaten Sukoharjo, Jawa Tengah;
A102.087;D'STADION RESTAURANT;cCustomer;D'STADION RESTAURANT;Restaurant;803;102;1000000;0;0.0000.00000.00000.;"BU RITA - 081802570807 
 DREAMT PHOTOGRAPHY 
 THE PARK MALL SOLOBARU - SF-18 
 LANTAI PALING ATAS DEPAN ORCHARD JELE";DREAMT PHOTOGRAPHY;"BU RITA - 081802570807 
 DREAMT PHOTOGRAPHY 
 THE PARK MALL SOLOBARU - SF-18 
 LANTAI PALING ATAS DEPAN ORCHARD JELE";
A102.1;EATBOSS SOLO (CV. MAKMUR SENTOSO);cCustomer;CV. MAKMUR SENTOSO;Restaurant;803;102;7000000;0;0.0000.00000.00000.;Jl. Sutan Syahrir No. 21, Kepatihan Wetan, Jebres, Surakarta;DUTA RASA MEATSHOP;Jl. Sutan Syahrir No. 21, Kepatihan Wetan, Jebres, Surakarta;
A102.289;EATERNITY RESTAURANT;cCustomer;EATERNITY RESTAURANT;Restaurant;803;102;2000000;7;0.0000.00000.00000.;paragon mall solo seberang dallas kitchen;dynasti;paragon mall solo seberang dallas kitchen;
A102.094;EL BURITOS;cCustomer;EL BURITOS;Restaurant;803;102;5000000;0;0.0000.00000.00000.;"HARTONO TRADE CENTER LT.P1/LT3 
 JL.IR SOEKARNO MADEGONDO GROGOL";EC KAROUKE SOLO;"HARTONO TRADE CENTER LT.P1/LT3 
 JL.IR SOEKARNO MADEGONDO GROGOL";
A102.097;EL BURRITOS;cCustomer;EL BURRITOS;Restaurant;803;102;1000000;0;0.0000.00000.00000.;Jl. Gajah Mada No.115, Ketelan, Banjarsari, Kota Surakarta, Jawa Tengah;EGGPERIANCE;Jl. Gajah Mada No.115, Ketelan, Banjarsari, Kota Surakarta, Jawa Tengah;
A102.093;EMPEROR PLACE CHINESE RESTAURANT;cCustomer;EMPEROR PLACE CHINESE RESTAURANT;Restaurant;803;102;15000000;0;0.0000.00000.00000.;"EL BURITOS 
 FOODCOURT INDOMARET LT.2 
 JL. KARTIKA RAYA NO.168, JEBRES (083865526650)";EL BURITOS;"EL BURITOS 
 FOODCOURT INDOMARET LT.2 
 JL. KARTIKA RAYA NO.168, JEBRES (083865526650)";
A115.026;ENI MANDIRI;cCustomer;ENI MANDIRI;Restaurant;803;102;5000000;0;0.0000.00000.00000.;"JL. MH.thamrin No. 21 Manahan 
  
 solo";EL BURRITOS;"JL. MH.thamrin No. 21 Manahan 
  
 solo";
A102.091;ERIGO;cCustomer;ERIGO;Restaurant;803;102;1000000;14;0.0000.00000.00000.;DAZIA BRIDALJl. Ir. H. Juanda No. 125 Solo, Surakarta;EMPEROR PLACE;DAZIA BRIDALJl. Ir. H. Juanda No. 125 Solo, Surakarta;
A102.092;ES ENY TERBAN;cCustomer;ES ENY TERBAN;Restaurant;803;102;300000;0;0.0000.00000.00000.;SOLO;ENI MANDIRI;SOLO;
A102.095;EUPHORIA;cCustomer;EUPHORIA;Restaurant;803;102;5000000;14;0.0000.00000.00000.;"Jl. Kebangkitan Nasional No.19 
 Solo";ERIGO;"Jl. Kebangkitan Nasional No.19 
 Solo";
A114.019;EXCELCO THE PARK SOLO BARU;cCustomer;EXCELCO THE PARK SOLO BARU;Restaurant;803;102;2000000;0;0.0000.00000.00000.;JL. AM SANGAJI (DEPAN POP Hotel);ES ENY;JL. AM SANGAJI (DEPAN POP Hotel);
A114.02;EXCELSO SOLO;cCustomer;EXCELSO SOLO;Restaurant;803;102;5000000;0;0.0000.00000.00000.;Jl.Mh Thamrin no 7 Manahan Solo;EUPHORIA;Jl.Mh Thamrin no 7 Manahan Solo;
A102.099;EXECUTIVE KARAOKE;cCustomer;EXECUTIVE KARAOKE;Restaurant;803;102;5000000;14;0.0000.00000.00000.;"The Park Mall Ground floor 
 Jln. Raya solo permai, solobaru, Sukoharjo";EXCELCO THE PARK SOLO BARU;"The Park Mall Ground floor 
 Jln. Raya solo permai, solobaru, Sukoharjo";
A102.103;FITSARIA;cCustomer;FITSARIA;Restaurant;803;102;5000000;30;0.0000.00000.00000.;Jl. Ir. Soekarno, Dusun I, Madegondo, Kec. Grogol, Kabupaten Sukoharjo, Jawa Tengah 57552;FAVE HOTEL SOLO BARU;Jl. Ir. Soekarno, Dusun I, Madegondo, Kec. Grogol, Kabupaten Sukoharjo, Jawa Tengah 57552;
A102.104;FITSARIA SRAGEN;cCustomer;FITSARIA SRAGEN;Restaurant;803;102;1000000;7;0.0000.00000.00000.;JL.DR RAJIMAN NO 37 (SEBELAH KUSUMA Hotel);FIFTY Restaurant;JL.DR RAJIMAN NO 37 (SEBELAH KUSUMA Hotel);
A102.011;FND (FOOD N DRINK);cCustomer;FND (FOOD N DRINK);Restaurant;803;102;1000000;0;0.0000.00000.00000.;JALAN SUTAN SYAHRIR NO.92, KEPATIHAN KULON, JEBRES, KOTA SURAKARTA, JAWA TENGAH 57129;FITSARIA;JALAN SUTAN SYAHRIR NO.92, KEPATIHAN KULON, JEBRES, KOTA SURAKARTA, JAWA TENGAH 57129;
A102.101;FOI GRILL & PASTA RESTAURANT;cCustomer;FOI GRILL & PASTA RESTAURANT;Restaurant;803;102;25000000;0;0.0000.00000.00000.;"FITSARIA SRAGEN 
 Jl. Ahmad Yani No.53, Kebayan 3, Sragen Tengah, Sragen";FITSARIA SRAGEN;"FITSARIA SRAGEN 
 Jl. Ahmad Yani No.53, Kebayan 3, Sragen Tengah, Sragen";
A101.022;GARDEN HOUSE;cCustomer;GARDEN HOUSE;Restaurant;803;102;1000000;0;0.0000.00000.00000.;Jl. Anggrek Raya BF 20 Solo Baru;FRUIT STORY;Jl. Anggrek Raya BF 20 Solo Baru;
A102.072;GARDEN RESTO NEW DE PARIS;cCustomer;GARDEN RESTO NEW DE PARIS;Restaurant;803;102;4000000;0;0.0000.00000.00000.;"Jl. R.M Said No. 149 Solo 
 Depan Apotek Padma Pasar Nongko";GAMON RESTO;"Jl. R.M Said No. 149 Solo 
 Depan Apotek Padma Pasar Nongko";
A102.108;GEROBAK PASTA;cCustomer;GEROBAK PASTA;Restaurant;803;102;1000000;0;0.0000.00000.00000.;Jl. Dr. Rajiman No.327, Panularan, Laweyan, Kota Surakarta, Jawa Tengah 57149;GARDEN RESTO SOLO;Jl. Dr. Rajiman No.327, Panularan, Laweyan, Kota Surakarta, Jawa Tengah 57149;
A102.109;GRANDIS RESTO (CV. JATI MAKMUR);cCustomer;CV. JATI MAKMUR;Restaurant;803;102;10000000;7;0.0000.00000.00000.;Jl. Viena Selatan Blok JB No. 37 Grogol Sukoharjo(Belakang Toyota Soba);GEDHEIN KOPI;Jl. Viena Selatan Blok JB No. 37 Grogol Sukoharjo(Belakang Toyota Soba);
A102.115;HUNGRY BEAR;cCustomer;HUNGRY BEAR;Restaurant;803;102;5000000;30;0.0000.00000.00000.;Hotel GRAND MEGA RESORTJln. TAMBAK ROWO NO.27CEPU;GRAND MEGA;Hotel GRAND MEGA RESORTJln. TAMBAK ROWO NO.27CEPU;
A114.023;GRINGO'S CAFE;cCustomer;GRINGO'S CAFE;Restaurant;803;102;0;28;0.0000.00000.00000.;Jl. Gajahmada No. 29Solo;GRAND ORCHID;Jl. Gajahmada No. 29Solo;
A102.323;GUDEG MBAK YUS;cCustomer;GUDEG MBAK YUS;Restaurant;803;102;1000000;30;0.0000.00000.00000.;Jl. Viena Utama JA 44 Dusun I Madegondo Grogol Sukoharjo;GRASS INN / LE VERRE;Jl. Viena Utama JA 44 Dusun I Madegondo Grogol Sukoharjo;
A114.024;GULA BATU;cCustomer;GULA BATU;Restaurant;803;102;5000000;0;0.0000.00000.00000.;Jl. Kenanga No.33, Solo, Purwosari, Laweyan, Kota Surakarta, Jawa Tengah (PLAYGROUND BADRAN);GRILL US;Jl. Kenanga No.33, Solo, Purwosari, Laweyan, Kota Surakarta, Jawa Tengah (PLAYGROUND BADRAN);
A102.111;HAILAI RESTAURANT;cCustomer;HAILAI RESTAURANT;Restaurant;803;102;300000;30;0.0000.00000.00000.;Jl. Tejonoto 3 No. 3, Danukusuman, Kec. Serengan, Kota Surakarta, Jawa Tengah 57156;Gudeg Mbak Yus;Jl. Tejonoto 3 No. 3, Danukusuman, Kec. Serengan, Kota Surakarta, Jawa Tengah 57156;
A102.113;HALLO SOLO RESTO;cCustomer;HALLO SOLO RESTO;Restaurant;803;102;2000000;7;0.0000.00000.00000.;JL.DR SOEPOMO 59.TURISARISURAKARTA;GULA BATU;JL.DR SOEPOMO 59.TURISARISURAKARTA;
A106.001;HAPPY TUTI;cCustomer;HAPPY TUTI;Restaurant;803;102;5000000;0;0.0000.00000.00000.;SOLO;GUN FROZEN FOOD;SOLO;
A102.014;HAPPY TUTI;cCustomer;HAPPY TUTI;Restaurant;803;102;5000000;28;0.0000.00000.00000.;Jl. Adi Sucipto No.146Solo;HAILAI;Jl. Adi Sucipto No.146Solo;
A102.117;HELLO COW;cCustomer;HELLO COW;Restaurant;803;102;5000000;30;0.0000.00000.00000.;Jl. Slamet Riyadi No. 180 KabalanNgadirejo Kec. Kartasura Kab. SukoharjoJawa Tengah;HEIKA KOPI KARTASURA;Jl. Slamet Riyadi No. 180 KabalanNgadirejo Kec. Kartasura Kab. SukoharjoJawa Tengah;
A102.012;HIKARU DINING SOLO;cCustomer;HIKARU DINING SOLO;Restaurant;803;102;10000000;30;0.0000.00000.00000.;Jl. Jendral Sudirman No. 202 Bendosari Sukoharjo;HEIKA KOPI SUKOHARJO;Jl. Jendral Sudirman No. 202 Bendosari Sukoharjo;
A102.013;HOB (EX. SCORE BAR);cCustomer;HOB (EX. SCORE BAR);Restaurant;803;102;50000000;7;0.0000.00000.00000.;JALAN SLAMET RIYADI;HELLO COW;JALAN SLAMET RIYADI;
A102.112;HOME CAFE & RESTAURANT;cCustomer;HOME CAFE & RESTAURANT;Restaurant;803;102;8000000;7;0.0000.00000.00000.;Jl. Dr. Muwardi, ManahanSolo;HELLO SOLO;Jl. Dr. Muwardi, ManahanSolo;
A114.029;HONKY TONK PIZZABAR;cCustomer;HONKY TONK PIZZABAR;Restaurant;803;102;5000000;0;0.0000.00000.00000.;HARTONO MALL SOLO(GROUND FLOOR)JL. IR SOEKARNO, SOLO BARU, MADEGONDOSUKOHARJO - JAWA TENGAH;HIKARU DINING SOLO;HARTONO MALL SOLO(GROUND FLOOR)JL. IR SOEKARNO, SOLO BARU, MADEGONDOSUKOHARJO - JAWA TENGAH;
A101.02;HOTEL GRAND MEGA RESORT;cCustomer;HOTEL GRAND MEGA RESORT;Restaurant;803;102;300000;14;0.0000.00000.00000.;THE PARK MALL (SAMPING SCORE BAR)GF 26-27JLN. IR. SOEKARNO, GROGOL SUKOHARJO;HOB;THE PARK MALL (SAMPING SCORE BAR)GF 26-27JLN. IR. SOEKARNO, GROGOL SUKOHARJO;
A102.114;HOUSE OF BEER;cCustomer;HOUSE OF BEER;Restaurant;803;102;5000000;7;0.0000.00000.00000.;JL. IR SUTAMI NO 46 ( GEDUNG GRAVISTA LT.1) SEKARPACE, JEBRES , KOTA SURAKARTA;HONKY TONK PIZZABAR;JL. IR SUTAMI NO 46 ( GEDUNG GRAVISTA LT.1) SEKARPACE, JEBRES , KOTA SURAKARTA;
A102.116;HUNGRY BEAR (WIDURAN);cCustomer;HUNGRY BEAR (WIDURAN);Restaurant;803;102;5000000;30;0.0000.00000.00000.;Jl. Brigjend Slamet Riyadi No.125, Serengan, Surakarta;Hotel KOTA (NANDA);Jl. Brigjend Slamet Riyadi No.125, Serengan, Surakarta;
A114.031;IEKE COFFE GELLATO;cCustomer;IEKE COFFE GELLATO;Restaurant;803;102;5000000;0;0.0000.00000.00000.;SOLO;IBU UTAMI;SOLO;
A102.12;IN CONTRO RESTAURANT (PT. CIPTA REJEKI BERSAMA);cCustomer;PT. CIPTA REJEKI BERSAMA;Restaurant;803;102;5000000;7;0.0000.00000.00000.;"JL. YOS.SUDARSO NO. 197 
 SOLO";IEKE COFFE GELLATO;"JL. YOS.SUDARSO NO. 197 
 SOLO";
A102.124;ISTANBUL KEBAB TURKI;cCustomer;ISTANBUL KEBAB TURKI;Restaurant;803;102;1000000;0;0.0000.00000.00000.;Jalan Adisucipto 109ColomaduSurakarta 57171;IHS;Jalan Adisucipto 109ColomaduSurakarta 57171;
A102.125;INSHOKU IKI RESTO;cCustomer;INSHOKU IKI RESTO;Restaurant;803;102;20000000;0;0.0000.00000.00000.;"Jl. Raya Solo Baru No. 20 
 Solo";ILALANG;"Jl. Raya Solo Baru No. 20 
 Solo";
A102.118;INTRO LOUNGE AND RESTO;cCustomer;INTRO LOUNGE AND RESTO;Restaurant;803;102;300000;30;0.0000.00000.00000.;Jl. Kebangkitan Nasional No.33, Sriwedari, Kec. Laweyan, Kota Surakarta;INDOCOW MEATSHOP;Jl. Kebangkitan Nasional No.33, Sriwedari, Kec. Laweyan, Kota Surakarta;
A102.307;INUL VISTA SOLO (CV. SAPTA BHARATA PRIMA);cCustomer;CV. SAPTA BHARATA PRIMA;Restaurant;803;102;3000000;7;0.0000.00000.00000.;JL.ALTERNATIF LAWU DAWUHAN TAWANGMANGU KARANGANYAR;INSHOKU IKI RESTO;JL.ALTERNATIF LAWU DAWUHAN TAWANGMANGU KARANGANYAR;
A102.121;ITALIAN DELIGHT PIZZA;cCustomer;ITALIAN DELIGHT PIZZA;Restaurant;803;102;5000000;0;0.0000.00000.00000.;"Mezzanine 3rd Floor 
 Solo Grand Mall, Jl. Slamet Riyadi 273 
 SOLO";INTRO;"Mezzanine 3rd Floor 
 Solo Grand Mall, Jl. Slamet Riyadi 273 
 SOLO";
A113.001;JAVA TERRACE KITCHEN & BAR (FoC);cCustomer;JAVA TERRACE KITCHEN & BAR (FoC);Restaurant;803;102;0;0;0.0000.00000.00000.;Jl. Dr. Rajiman No.627, Pajang Laweyan Surakarta;ISTANBUL KEBAB;Jl. Dr. Rajiman No.627, Pajang Laweyan Surakarta;
A102.275;JAVA TERRACE KITCHEN & BAR (PT. CIPTA PROPERTI AGUNG);cCustomer;PT. CIPTA PROPERTI AGUNG;Restaurant;803;102;60000000;14;0.0000.00000.00000.;Jl. Adi Sucipto, Jajar, Laweyan, Kota Surakarta, Jawa Tengah 57144, Indonesia;ITALIAN DELIGHT PIZZA;Jl. Adi Sucipto, Jajar, Laweyan, Kota Surakarta, Jawa Tengah 57144, Indonesia;
A101.072;JEJU AYCE;cCustomer;JEJU AYCE;Restaurant;803;102;1000000;14;0.0000.00000.00000.;Kampung Banjarsari RT. 01/ 04Kedung Ampel CawasKlaten;Jaka Meatshop;Kampung Banjarsari RT. 01/ 04Kedung Ampel CawasKlaten;
A102.09;DOBUTZO RESTAURANT;cCustomer;DOBUTZO RESTAURANT;Restaurant;803;102;5000000;0;0.0000.00000.00000.;Jl. Honggowongso No. 98Solo;java;Jl. Honggowongso No. 98Solo;
A102.309;JOY BAKERY;cCustomer;JOY BAKERY;Restaurant;803;102;1000000;14;31.588.178.9-526.000;Jl. Slamet Riyadi No. 464 Purwosari, Laweyan, Surakarta, Jawa Tengah;JAVA TERRACE KITCHEN & BAR;Jl. Slamet Riyadi No. 464 Purwosari, Laweyan, Surakarta, Jawa Tengah;
A113.004;JEJU AYCE (FoC);cCustomer;JEJU AYCE (FoC);Restaurant;803;102;0;30;0.0000.00000.00000.;Jl Slamet Riyadi no 464 Purwosari Laweyan Surakarta, Surakarta, Jawa Tengah;JAVA TERRACE KITCHEN & BAR (FoC);Jl Slamet Riyadi no 464 Purwosari Laweyan Surakarta, Surakarta, Jawa Tengah;
A102.135;KAKKOII RESTO;cCustomer;KAKKOII RESTO;Restaurant;803;102;5000000;0;0.0000.00000.00000.;Jl. Moh. Husni Thamrin No.7, Manahan, Kec. Banjarsari, Kota Surakarta, Jawa Tengah 57143;Jeju Ayce;Jl. Moh. Husni Thamrin No.7, Manahan, Kec. Banjarsari, Kota Surakarta, Jawa Tengah 57143;
A102.141;KAMI BURGER;cCustomer;KAMI BURGER;Restaurant;803;102;500000;0;0.0000.00000.00000.;Jl. Yosodipuro No.113, Mangkubumen, Banjarsari, Kota Surakarta, Jawa Tengah;JOY BAKERY;Jl. Yosodipuro No.113, Mangkubumen, Banjarsari, Kota Surakarta, Jawa Tengah;
A102.016;KAMPUNG CAHAYA;cCustomer;KAMPUNG CAHAYA;Restaurant;803;102;5000000;0;0.0000.00000.00000.;Jl. Adi Sucipto No.99, Jajar, Laweyan, Kota Surakarta;KAKKOII RESTO;Jl. Adi Sucipto No.99, Jajar, Laweyan, Kota Surakarta;
A102.133;KAMPUNG CAHAYA RESTAURAN;cCustomer;KAMPUNG CAHAYA RESTAURAN;Restaurant;803;102;5000000;7;0.0000.00000.00000.;JALAN ABDUL RAHMAN SHALEH STABELAN SURAKARTA (BEKAS PIPILLINE);KAMAYANGAN COFFE;JALAN ABDUL RAHMAN SHALEH STABELAN SURAKARTA (BEKAS PIPILLINE);
A102.139;KEBAB TURKI;cCustomer;KEBAB TURKI;Restaurant;803;102;1000000;14;0.0000.00000.00000.;"JLN. DR SUTOMO NO 24 SRIWEDARI 
 LAWEYAN SOLO";KARONSSIH RESTO;"JLN. DR SUTOMO NO 24 SRIWEDARI 
 LAWEYAN SOLO";
A102.136;KEDAI ABDULLAH;cCustomer;KEDAI ABDULLAH;Restaurant;803;102;500000;0;0.0000.00000.00000.;JL.KEBANGKITAN NASIONAL NO 45;KARYAWAN INDOGUNA;JL.KEBANGKITAN NASIONAL NO 45;
A102.138;KENEE GRILL & SUKI;cCustomer;KENEE GRILL & SUKI;Restaurant;803;102;5000000;7;0.0000.00000.00000.;JL. R.M Said No. 93Solo;KEDAI KOPI;JL. R.M Said No. 93Solo;
A102.131;KEDAI PASTA D'PUTU BUMBUNG;cCustomer;KEDAI PASTA D'PUTU BUMBUNG;Restaurant;803;102;5000000;7;0.0000.00000.00000.;Jalan Brigjend Slamet Riyadi, Solo Square, Bengawan Solo Food Court, Laweyan, Pajang, Solo, Jawa Tengah;KEDAI KOPI MATARAM;Jalan Brigjend Slamet Riyadi, Solo Square, Bengawan Solo Food Court, Laweyan, Pajang, Solo, Jawa Tengah;
A102.129;KIMCHI RESTAURANT;cCustomer;KIMCHI RESTAURANT;Restaurant;803;102;2000000;0;0.0000.00000.00000.;JLN. PUNTODEWO NO.4 , KUDU, BAKI, SUKOHARJO (BELAKANG KANTOR KECAMATAN BAKI);KERIPIK PARU SARI ROSO;JLN. PUNTODEWO NO.4 , KUDU, BAKI, SUKOHARJO (BELAKANG KANTOR KECAMATAN BAKI);
A102.137;KIMUKATSU (PT. BOGA MAKMUR DINASTI);cCustomer;PT. BOGA MAKMUR DINASTI;Restaurant;803;102;10000000;0;0.0000.00000.00000.;"Jln Diponegoro Cluster Diponegoro No. A6 
 Dusun III Madegondo Grogol Sukoharjo";KEVIN;"Jln Diponegoro Cluster Diponegoro No. A6 
 Dusun III Madegondo Grogol Sukoharjo";
A102.14;KLASSIKO BAKERY (YUDHISTIRA);cCustomer;KLASSIKO BAKERY (YUDHISTIRA);Restaurant;803;102;1000000;7;0.0000.00000.00000.;JL. SIWALAN NO 17 RT02 RW14 , KERTEN , LAWWEYAN , SURAKARTA;KHAS COFFE;JL. SIWALAN NO 17 RT02 RW14 , KERTEN , LAWWEYAN , SURAKARTA;
A102.142;KOCHAMJJANG;cCustomer;KOCHAMJJANG;Restaurant;803;102;1000000;0;0.0000.00000.00000.;JL. Teuku Umar No.12, Keprabon, Banjarsari;KHENG HOUSE;JL. Teuku Umar No.12, Keprabon, Banjarsari;
A102.311;KEDAI SARANG BAKERY;cCustomer;KEDAI SARANG BAKERY;Restaurant;803;102;20000000;7;0.0000.00000.00000.;Jl. Imam Bonjol No.52 Kp.Baru Pasar KliwonSurakarta.;KOPI NDOMBLONG;Jl. Imam Bonjol No.52 Kp.Baru Pasar KliwonSurakarta.;
A102.128;K PATATS SOLO;cCustomer;K PATATS SOLO;Restaurant;803;102;300000;0;0.0000.00000.00000.;JL. Dr Radjiman No. 441, Bumi, LaweyanSurakarta;KOPI NGELAK;JL. Dr Radjiman No. 441, Bumi, LaweyanSurakarta;
A102.059;BOSSGRILL AND BBQ;cCustomer;BOSSGRILL AND BBQ;Restaurant;803;102;1000000;0;0.0000.00000.00000.;"PERUM. SONGGOLANGIT 
 JL. EMPU PANULUH NO.7 
 SOLO";KUE BLONJO;"PERUM. SONGGOLANGIT 
 JL. EMPU PANULUH NO.7 
 SOLO";
A102.147;LA CASETTA;cCustomer;LA CASETTA;Restaurant;803;102;5000000;14;0.0000.00000.00000.;OMAH SINTENJl. Diponegoro Keprabon Kec. Banjarsari Kota Surakarta Jawa Tengah;KULONUWUN KOPI;OMAH SINTENJl. Diponegoro Keprabon Kec. Banjarsari Kota Surakarta Jawa Tengah;
A102.15;LA MEXICANA;cCustomer;LA MEXICANA;Restaurant;803;102;5000000;28;03.293.269.1-514.000;Jl. Raya Cepu - Randublatung No.Km. 2, Joho, Mulyorejo, Kec. Cepu, Kabupaten Blora;KYRIAD ARRA Hotel;Jl. Raya Cepu - Randublatung No.Km. 2, Joho, Mulyorejo, Kec. Cepu, Kabupaten Blora;
A102.145;LA TAVERNA RESTO;cCustomer;LA TAVERNA RESTO;Restaurant;803;102;2000000;7;0.0000.00000.00000.;Jl. Arifin No. 89, kepatihan wetan, jebres, surakarta;LA JAVA KEPATIHAN;Jl. Arifin No. 89, kepatihan wetan, jebres, surakarta;
A102.144;LARISKA RESTO;cCustomer;LARISKA RESTO;Restaurant;803;102;0;7;0.0000.00000.00000.;Jl. Ir. Soekarno 3, Dusun I, Madegondo, Kec. Grogol,;LA JAVA SOBA;Jl. Ir. Soekarno 3, Dusun I, Madegondo, Kec. Grogol,;
A102.017;LAVA BAR AND KITCHEN (CV. DASA JAYA PERKASA);cCustomer;CV. DASA JAYA PERKASA;Restaurant;803;102;10000000;30;0.0000.00000.00000.;Jl tentara pelajar no.156 bolon colomadu karanganyar;LA MEXICANA;Jl tentara pelajar no.156 bolon colomadu karanganyar;
A106.009;LAZY COW;cCustomer;LAZY COW;Restaurant;803;102;15000000;0;0.0000.00000.00000.;JL. SIWALAN NO 55 KERTEN SOLO;LA TAVERNA RESTO;JL. SIWALAN NO 55 KERTEN SOLO;
A102.149;LEVEL ONE SOLO;cCustomer;LEVEL ONE SOLO;Restaurant;803;102;20000000;0;0.0000.00000.00000.;Jl. Dr. Rajiman No.527, Pajang, Laweyan, Surakarta;LAWEYAN BLUE MBAH BEI;Jl. Dr. Rajiman No.527, Pajang, Laweyan, Surakarta;
A102.146;LIBERICA CAFE ALILA;cCustomer;LIBERICA CAFE ALILA;Restaurant;803;102;2000000;7;0.0000.00000.00000.;Kramat Kalisoro Tawangmangu Karanganyar;LAWU BREAK;Kramat Kalisoro Tawangmangu Karanganyar;
A114.048;LIBERICA COFFEE (PT. LIBERICA);cCustomer;PT. LIBERICA;Restaurant;803;102;2000000;7;0.0000.00000.00000.;Jl. Slamet Riyadi (Timur Mc. Donald)Surakarta;Lazy Cow;Jl. Slamet Riyadi (Timur Mc. Donald)Surakarta;
A102.143;LILY BISTRO;cCustomer;LILY BISTRO;Restaurant;803;102;300000;0;0.0000.00000.00000.;JALAN KEBANGKITAN NASIONAL , SURAKARTA .;LEGACY;JALAN KEBANGKITAN NASIONAL , SURAKARTA .;
A114.049;LIVING ROOM CAFE TRANSMART;cCustomer;LIVING ROOM CAFE TRANSMART;Restaurant;803;102;1500000;7;0.0000.00000.00000.;Jl. Dr. Cipto Mangunkusumo No.3, Sriwedari, Kec. Laweyan, Kota Surakarta, Jawa Tengah 57141;LEVEL ONE SOLO;Jl. Dr. Cipto Mangunkusumo No.3, Sriwedari, Kec. Laweyan, Kota Surakarta, Jawa Tengah 57141;
A102.166;MABAR & LAVINE MANAHAN;cCustomer;MABAR & LAVINE MANAHAN;Restaurant;803;102;2500000;14;0.0000.00000.00000.;"Jl. RM. Said No. 257 
 Solo";LILY;"Jl. RM. Said No. 257 
 Solo";
A102.159;MADAM XIANG;cCustomer;MADAM XIANG;Restaurant;803;102;5000000;7;0.0000.00000.00000.;Komplek Trans Mart MallPabelan Solo;LIVING ROOM CAFE;Komplek Trans Mart MallPabelan Solo;
A114.058;MAKALU COFFE;cCustomer;MAKALU COFFE;Restaurant;803;102;1000000;7;0.0000.00000.00000.;JALAN GATOT SUBROTO NO.51SEBELAH KURNIA MUSIK(ALAT TULIS SEBRANG KURNIA MUSIK);MADAM XIANG;JALAN GATOT SUBROTO NO.51SEBELAH KURNIA MUSIK(ALAT TULIS SEBRANG KURNIA MUSIK);
A102.155;MARY ANNE'S RESTAURANT SOLO;cCustomer;MARY ANNE'S RESTAURANT SOLO;Restaurant;803;102;5000000;0;0.0000.00000.00000.;Jalan Untung Suropati No.76, Kedung Lumbu, Pasar Kliwon, Surakarta, Pasar Kliwon, Surakarta City, Central Java 57113, Indonesia;MARAKEZ;Jalan Untung Suropati No.76, Kedung Lumbu, Pasar Kliwon, Surakarta, Pasar Kliwon, Surakarta City, Central Java 57113, Indonesia;
A102.164;MASTER CHEESE PIZZA;cCustomer;MASTER CHEESE PIZZA;Restaurant;803;102;10000000;28;0.0000.00000.00000.;JALAN KEBANGKITAN NASIONAL NO 45;MARKETING SOLO;JALAN KEBANGKITAN NASIONAL NO 45;
A102.156;MAZROONEY CORNER;cCustomer;MAZROONEY CORNER;Restaurant;803;102;10000000;30;0.0000.00000.00000.;Perum Queen Garden Blok IV No H23, Sukoharjo, Jawa Tengah;MARTHA FOOD;Perum Queen Garden Blok IV No H23, Sukoharjo, Jawa Tengah;
A102.192;PANDAN LEAF BAKERY CAKE;cCustomer;PANDAN LEAF BAKERY CAKE;Restaurant;803;102;300000;14;0.0000.00000.00000.;"JLN. YOS SUDARSO NO.376 
 SOLO";MARVIN;"JLN. YOS SUDARSO NO.376 
 SOLO";
A114.057;MBAH MAN TAWANGMANGU;cCustomer;MBAH MAN TAWANGMANGU;Restaurant;803;102;1000000;7;0.0000.00000.00000.;JLN. KEBANGKITAN NASIONAL NO.54PENUMPING, SOLO (SELATAN STADION SRIWEDARI);MARY ANNE'S Restaurant SOLO;JLN. KEBANGKITAN NASIONAL NO.54PENUMPING, SOLO (SELATAN STADION SRIWEDARI);
A102.134;KAMPOENG BAROE;cCustomer;KAMPOENG BAROE;Restaurant;803;102;1000000;14;92.496.659.1-526.000;Jl. Lawu No.1c, Perum Subur Makmur, RT.01/RW.25, Sumbermakmur, Ngringo, Kec. Jaten, Kabupaten Karanganyar,;MBAK NINIS;Jl. Lawu No.1c, Perum Subur Makmur, RT.01/RW.25, Sumbermakmur, Ngringo, Kec. Jaten, Kabupaten Karanganyar,;
A102.153;MELLY GLOW KTV (PT. MITRA INTI CIPTA PERKASA);cCustomer;PT. MITRA INTI CIPTA PERKASA;Restaurant;803;102;5000000;0;0.0000.00000.00000.;SOLO;MBK.YANIK;SOLO;
A102.327;MENUR RESTO;cCustomer;MENUR RESTO;Restaurant;803;102;5000000;14;0.0000.00000.00000.;"JLN. R.M SAID NO 49 TOTOGAN 
 MANGKUNEGARAN";MBOK MARNI;"JLN. R.M SAID NO 49 TOTOGAN 
 MANGKUNEGARAN";
