U_OldCode;CardName;CardType;CardFName;Type;Series;GroupCode;CreditLimit;U_locktimeout;FederalTaxID;MailAddress;Outlet;Address;Delivery Route
A104.002;KUSUMA CATERING;cCustomer;KUSUMA CATERING;Catering;804;103;5000000;7;0.0000.00000.00000.;Jl. Raya Tawangmangu-Sarangan Kilometer 9. Bulakrejo RT 3 RW 6 Gondosuli Kidul Gondosuli Kec. Tawangmangu Kabupaten Karanganyar;KOPI PAK NO;Jl. Raya Tawangmangu-Sarangan Kilometer 9. Bulakrejo RT 3 RW 6 Gondosuli Kidul Gondosuli Kec. Tawangmangu Kabupaten Karanganyar;
A102.332;KUSUMA SARI;cCustomer;KUSUMA SARI;Catering;804;103;5000000;7;0.0000.00000.00000.;Jl. Kalitan No.6B, Penumping, Laweyan, Surakarta;KOPI SI BUDI;Jl. Kalitan No.6B, Penumping, Laweyan, Surakarta;
A104.003;MARIAM CATERING SOLO;cCustomer;MARIAM CATERING SOLO;Catering;804;103;1000000;14;0.0000.00000.00000.;"Setabelan, Kec. Banjarsari, Kota Surakarta, Jawa Tengah 57133
 (SAMPING PASAR LEGI)";MAHALAYA;"Setabelan, Kec. Banjarsari, Kota Surakarta, Jawa Tengah 57133
 (SAMPING PASAR LEGI)";
A104.004;NIKMAT RASA CATERING;cCustomer;NIKMAT RASA CATERING;Catering;804;103;1000000;7;55.414.101.0-532.000;JL.MAWAR 3 NO 11A SIDOREJO JANTEN KARANGANYAR;NGOPI SERIUS;JL.MAWAR 3 NO 11A SIDOREJO JANTEN KARANGANYAR;
A102.001;SARI ROSO;cCustomer;SARI ROSO;Catering;804;103;5000000;28;31.594.040.3-526.000;Sala View HotelJL. SLAMET RIYADI NO.450 RT 02 RW 13 PURWOSARI, LAWEYAN, SURAKARTA;PT PANCA WIBAWA UTAMA;Sala View HotelJL. SLAMET RIYADI NO.450 RT 02 RW 13 PURWOSARI, LAWEYAN, SURAKARTA;
A104.006;SUNNY CATERING;cCustomer;SUNNY CATERING;Catering;804;103;5000000;0;0.0000.00000.00000.;Jl. Palagan Tentara Pelajar No. 106, Kel. Sari Harjo, Kec. Ngaglik, Kabupaten Sleman, Daerah Istimewa Yogyakarta;SUGAR KARAOKE;Jl. Palagan Tentara Pelajar No. 106, Kel. Sari Harjo, Kec. Ngaglik, Kabupaten Sleman, Daerah Istimewa Yogyakarta;
A102.27;TSABITA JASA BOGA;cCustomer;TSABITA JASA BOGA;Catering;804;103;3000000;7;0.0000.00000.00000.;SOLO;THOMAS;SOLO;
A104.007;TULAS CATERING;cCustomer;TULAS CATERING;Catering;804;103;10000000;0;0.0000.00000.00000.;"Jl. Jend. Urip Sumoharjo No.94 
 Purwodiningratan Kec. Jebres 
 Kota Surakarta";TIMLO SOLO;"Jl. Jend. Urip Sumoharjo No.94 
 Purwodiningratan Kec. Jebres 
 Kota Surakarta";
A106.006;AZKAYRA FROZEN;cCustomer;AZKAYRA FROZEN;Distributor;811;110;3000000;30;0.0000.00000.00000.;BANDARA ADI SUMARMODAERAH GAGAK SIPAT;AZHIMA Hotel BANDARA;BANDARA ADI SUMARMODAERAH GAGAK SIPAT;
A106.007;BANDAR AA;cCustomer;BANDAR AA;Distributor;811;110;300000;14;0.0000.00000.00000.;"JL. HONGGOWONGSO NO.29 
 (SEBELAH AM PM RESTO) 
 SOLO";BAKE IT;"JL. HONGGOWONGSO NO.29 
 (SEBELAH AM PM RESTO) 
 SOLO";
A114.01;BEANS AND CO;cCustomer;BEANS AND CO;Distributor;811;110;3000000;28;0.0000.00000.00000.;Jl. Dr. Radjiman No.392, Laweyan, Kota Surakarta, Jawa Tengah 57141;BARON INDAH Hotel;Jl. Dr. Radjiman No.392, Laweyan, Kota Surakarta, Jawa Tengah 57141;
A106.012;BEEF BRO MEATSHOP SOLO;cCustomer;BEEF BRO MEATSHOP SOLO;Distributor;811;110;10000000;0;0.0000.00000.00000.;Purwosari, Laweyan, Surakarta;BBQIU;Purwosari, Laweyan, Surakarta;
A106.015;JAKA MEATSHOP;cCustomer;JAKA MEATSHOP;Distributor;811;110;5000000;14;02.768.734.2-512.000;SOLO SQUARE Lt.2JL. SLAMET RIYADI NO.451-455, SOLO;CV. SAPTA BHARATA PRIMA;SOLO SQUARE Lt.2JL. SLAMET RIYADI NO.451-455, SOLO;
A106.013;DUTA RASA MEATSHOP;cCustomer;DUTA RASA MEATSHOP;Distributor;811;110;5000000;0;0.0000.00000.00000.;JLN. YOS SUDARSO 323BDANUKUSUMAN, SERENGAN SOLO 57139;D's DINNER CAFE & RESTO;JLN. YOS SUDARSO 323BDANUKUSUMAN, SERENGAN SOLO 57139;
A104.001;DHAMA ALILA;cCustomer;DHAMA ALILA;Distributor;811;110;8000000;0;0.0000.00000.00000.;JL. SLAMET RIYADI NO. 54 BSOLO;De SOLO;JL. SLAMET RIYADI NO. 54 BSOLO;
A102.067;DEVORA DIARY;cCustomer;DEVORA DIARY;Distributor;811;110;5000000;0;0.0000.00000.00000.;"JL.PATMO NEGORO NO.29 
 100METER SEBELUM LUES GADING BELOK KANAN";DEPOT MURNI;"JL.PATMO NEGORO NO.29 
 100METER SEBELUM LUES GADING BELOK KANAN";
A106.025;GUN FROZEN FOOD;cCustomer;GUN FROZEN FOOD;Distributor;811;110;2000000;7;0.0000.00000.00000.;GRINGO'S CAFEJL. RONGGOWARSITO NO. 5 CSOLO;GRINGO;GRINGO'S CAFEJL. RONGGOWARSITO NO. 5 CSOLO;
A106.014;INDOCOW MEATSHOP;cCustomer;INDOCOW MEATSHOP;Distributor;811;110;10000000;0;0.0000.00000.00000.;Jl. Haryo Panular No.48, Panularan, Laweyan, Panularan, Laweyan;IELC;Jl. Haryo Panular No.48, Panularan, Laweyan, Panularan, Laweyan;
A106.004;JURAGAN FROZEN (MBA NINIS);cCustomer;JURAGAN FROZEN (MBA NINIS);Distributor;811;110;5000000;30;0.0000.00000.00000.;Jl. Moh. Husni Thamrin No.7, Manahan, Kec. Banjarsari, Kota Surakarta, Jawa Tengah 57143;JEJU AYCE;Jl. Moh. Husni Thamrin No.7, Manahan, Kec. Banjarsari, Kota Surakarta, Jawa Tengah 57143;
A102.167;MADJA (CV. TIGA PILLAR SEJATI);cCustomer;CV. TIGA PILLAR SEJATI;Distributor;811;110;20000000;30;0.0000.00000.00000.;MENARA ONE BILDING JL. KEDEN , HONGGOBAYAN , PABELAN, KEC , KARTOSURO;LUX CAFE;MENARA ONE BILDING JL. KEDEN , HONGGOBAYAN , PABELAN, KEC , KARTOSURO;
A106.002;MARTHA FOOD;cCustomer;MARTHA FOOD;Distributor;811;110;2000000;30;0.0000.00000.00000.;Pined Perigee, Jl. Dr. Rajiman No.234, Kemlayan, Kec. Serengan, Kota Surakarta,;MAKAN DAGING;Pined Perigee, Jl. Dr. Rajiman No.234, Kemlayan, Kec. Serengan, Kota Surakarta,;
A106.028;SUNRISE MEATSHOP & SUPLIYER;cCustomer;SUNRISE MEATSHOP & SUPLIYER;Distributor;811;110;5000000;14;26.292.771.8-532.000;JL. MANGGA DC-4 SOLO BARU, LANGENHARJO RT.00 RW.00, LANGENHARJO, GROGOL, SUKOHARJO, JAWA TENGAH 00000;MAPS Restaurant;JL. MANGGA DC-4 SOLO BARU, LANGENHARJO RT.00 RW.00, LANGENHARJO, GROGOL, SUKOHARJO, JAWA TENGAH 00000;
A106.003;MAS DENI HS;cCustomer;MAS DENI HS;Distributor;811;110;5000000;0;0.0000.00000.00000.;SOLO BARU;MARIAM Catering SOLO;SOLO BARU;
A106.01;MEAT & GROCERIES SOLO;cCustomer;MEAT & GROCERIES SOLO;Distributor;811;110;300000;0;0.0000.00000.00000.;Jl Ahmad Yani 123 Ngemplak Solo;MAZROONEY CORNER;Jl Ahmad Yani 123 Ngemplak Solo;
A102.316;OLEH OLEH BU MARGONO;cCustomer;OLEH OLEH BU MARGONO;Distributor;811;110;5000000;14;0.0000.00000.00000.;"JL SLAMET RIYADI 
 KLECO-SOLO";OBONK KLECO;"JL SLAMET RIYADI 
 KLECO-SOLO";
A115.031;IBU FONNY;cCustomer;IBU FONNY;Distributor;811;110;15000000;0;0.0000.00000.00000.;SOLO;PAK ALBERT/BU CITRA;SOLO;
A115.006;PAK SETIAWAN;cCustomer;PAK SETIAWAN;Distributor;811;110;20000000;0;0.0000.00000.00000.;JL.SUMATRA 5 No 3A,Depan Gereja GKN Hosana Ketelat,(monumen pers ketimur gang ke 2 belok kiri);PAK FENDY;JL.SUMATRA 5 No 3A,Depan Gereja GKN Hosana Ketelat,(monumen pers ketimur gang ke 2 belok kiri);
A106.03;TOKO ATOM;cCustomer;TOKO ATOM;Distributor;811;110;1000000;30;01.705.502.1-526.000;JL. JEND.A.YANI NO.40 SURAKARTA;PT. GRAHAMULYA WIRASTAMA;JL. JEND.A.YANI NO.40 SURAKARTA;
A106.022;TOKO ASIA BARU;cCustomer;TOKO ASIA BARU;Distributor;811;110;1000000;30;01.609.790.9.526.002;THE ROYAL SURAKARTA HEARITAGE Hotel(EX. BESTWESTERN SOLO)JL. SLAMET RIYADI NO.272SOLO;PT. SUNINDO INDAH Hotel;THE ROYAL SURAKARTA HEARITAGE Hotel(EX. BESTWESTERN SOLO)JL. SLAMET RIYADI NO.272SOLO;
A102.33;SENTRAL PANGAN;cCustomer;SENTRAL PANGAN;Distributor;811;110;2000000;14;0.0000.00000.00000.;"THE PARK MALL 
 GF 26-27 
 JLN. IR. SOEKARNO, GROGOL SUKOHARJO";SCORE BAR & LOUNGE;"THE PARK MALL 
 GF 26-27 
 JLN. IR. SOEKARNO, GROGOL SUKOHARJO";
A106.02;SUMBER JADI JAYA;cCustomer;SUMBER JADI JAYA;Distributor;811;110;15000000;14;82.444.437.6-528.000;PG.COLOMADU SOLO;STREET FOOD PG.CL MADU;PG.COLOMADU SOLO;
A106.023;UD. ALASKA FOOD SERVICE;cCustomer;UD. ALASKA FOOD SERVICE;Distributor;811;110;20000000;0;0.0000.00000.00000.;JL. RONGGOWARSITO NO 164, TIMURAN , BANJARSARI, SURAKARTA.;TJANGKIR GENDHIS;JL. RONGGOWARSITO NO 164, TIMURAN , BANJARSARI, SURAKARTA.;
A102.004;UD ARGA SARI;cCustomer;UD ARGA SARI;Distributor;811;110;300000;0;0.0000.00000.00000.;Jalan Dokter Soepomo No.51, Mangkubumen, Banjarsari;TJEMAL TJEMIL;Jalan Dokter Soepomo No.51, Mangkubumen, Banjarsari;
A106.027;UD. SALIM;cCustomer;UD. SALIM;Distributor;811;110;300000;14;0.0000.00000.00000.;"THE PARK SOLO 
 JLN. IR. SOEKARNO 
 GROGOL SUKOHARJO";TOKIO BOWL;"THE PARK SOLO 
 JLN. IR. SOEKARNO 
 GROGOL SUKOHARJO";
A102.308;YUMMY BEEF;cCustomer;YUMMY BEEF;Distributor;811;110;1000000;0;0.0000.00000.00000.;JL.YOS SUDARSO NO 337 DANUKUSUMAN SERENGAN;WHEELBUZ CAFE;JL.YOS SUDARSO NO 337 DANUKUSUMAN SERENGAN;
A102.336;OBONK STEAK SOLO (FoC);cCustomer;OBONK STEAK SOLO (FoC);FC;812;113;0;7;0.0000.00000.00000.;JL. CANDISARI KM 01. SENDAGAN , MOJAYAN, KLATEN TENGAH;NYAWIJI COFFE KLATEN;JL. CANDISARI KM 01. SENDAGAN , MOJAYAN, KLATEN TENGAH;
A110.005;PERSONAL (FoC);cCustomer;PERSONAL (FoC);FC;812;113;0;14;0.0000.00000.00000.;SOLO;PATBINGSOO;SOLO;
A113.002;ALILA HOTEL SOLO (FoC);cCustomer;ALILA HOTEL SOLO (FoC);FC;812;113;1000000;30;0.0000.00000.00000.;JL.SLAMET RIYADI 562 RT 001 RW 001, JAJAR, LAWEYAN, SURAKARTA;PT. NARENDRA LENTERA ADISAKTI;JL.SLAMET RIYADI 562 RT 001 RW 001, JAJAR, LAWEYAN, SURAKARTA;
A102.329;SFA STEAK KARANGANYAR (FoC);cCustomer;SFA STEAK KARANGANYAR (FoC);FC;812;113;0;0;0.0000.00000.00000.;Perumnas, Jalan Cempaka 1 No.9, Perumnas Ngringo, Ngringo, Kec. Jaten, Kabupaten Karanganyar, Jawa Tengah 57772;SELAT PUSPPA;Perumnas, Jalan Cempaka 1 No.9, Perumnas Ngringo, Ngringo, Kec. Jaten, Kabupaten Karanganyar, Jawa Tengah 57772;
A102.335;SOGA (FoC);cCustomer;SOGA (FoC);FC;812;113;50000000;0;0.0000.00000.00000.;"KOMPLEK RUKO PLAZA SOLO BARU BLOK 
 HB-08,SOLO BARU 
 SEBRANG BIMA KARAOKE";SIMHAE;"KOMPLEK RUKO PLAZA SOLO BARU BLOK 
 HB-08,SOLO BARU 
 SEBRANG BIMA KARAOKE";
A102.293;WISMA BOGA REST;cCustomer;WISMA BOGA REST;Hotel;802;100;2000000;0;0.0000.00000.00000.;"Jl. Slamet Riyadi No. 310 
 Solo";310;"Jl. Slamet Riyadi No. 310 
 Solo";
A101.056;HOTEL KOTA (NANDA);cCustomer;HOTEL KOTA (NANDA);Hotel;802;100;1000000;14;24.852.401.9-526.000;JL.DR RAJIMAN 149 RT.002 RW.007 DESA/KEL. JAYENGAN - KEC. SERENGAN SURAKARTA;ANDRIAN GUNAWAN;JL.DR RAJIMAN 149 RT.002 RW.007 DESA/KEL. JAYENGAN - KEC. SERENGAN SURAKARTA;
A101.004;ASTON HOTEL SOLO (PT. DUTA MITRA PROPERTINDO);cCustomer;PT. DUTA MITRA PROPERTINDO;Hotel;802;100;20000000;0;0.0000.00000.00000.;"JL. ANTARIKSA 3 KENTINGAN 
 JEBRES (SEBELAH BARAT TEMBOK RSJ SOLO) 
 SURAKARTA";ARJE'S KITCHEN;"JL. ANTARIKSA 3 KENTINGAN 
 JEBRES (SEBELAH BARAT TEMBOK RSJ SOLO) 
 SURAKARTA";
A102.005;AYOM JAVA VILLAGE;cCustomer;AYOM JAVA VILLAGE;Hotel;802;100;0;0;0.0000.00000.00000.;"Jl. Suryo 2 No. 51 A Jebres, Surakarta 
 Jawa Tengah";AYAM GEPREK ABANG IRENG;"Jl. Suryo 2 No. 51 A Jebres, Surakarta 
 Jawa Tengah";
A101.003;AZIZA HOTEL;cCustomer;AZIZA HOTEL;Hotel;802;100;10000000;14;0.0000.00000.00000.;Gatak,Gajahan,Colomadu,Kabupaten Karanganyar, Jawa Tengah;AYOM JAVA VILLAGE;Gatak,Gajahan,Colomadu,Kabupaten Karanganyar, Jawa Tengah;
A101.014;BARON INDAH HOTEL;cCustomer;BARON INDAH HOTEL;Hotel;802;100;5000000;30;0.0000.00000.00000.;PERUM GRIYA KENCANA I/B4 GUMPANG KARTASURA;BAPAK WIJIYANTO;PERUM GRIYA KENCANA I/B4 GUMPANG KARTASURA;
A101.013;BEST WESTERN SOLO BARU (PT. DELTA MERLIN DUNIA PROPERTI);cCustomer;PT. DELTA MERLIN DUNIA PROPERTI;Hotel;802;100;50000000;0;0.0000.00000.00000.;JL.SIWALAN NO.45B KERTEN;BERANDA RUMAH;JL.SIWALAN NO.45B KERTEN;
A101.048;SALA VIEW HOTEL (PT. PANCA WIBAWA UTAMA);cCustomer;PT. PANCA WIBAWA UTAMA;Hotel;802;100;5000000;7;0.0000.00000.00000.;JL.KALILARANGAN NO 8 SURAKARTA;BND PIZZA;JL.KALILARANGAN NO 8 SURAKARTA;
A101.012;BROTHERS HOTEL SOLO;cCustomer;BROTHERS HOTEL SOLO;Hotel;802;100;20000000;0;0.0000.00000.00000.;"Jl. Kemuning Blok J No. 7 Perum Puri Gading 
 Grogol Sukoharjo";BOSSGRILL AND BBQ;"Jl. Kemuning Blok J No. 7 Perum Puri Gading 
 Grogol Sukoharjo";
A101.015;BROTHERS INN;cCustomer;BROTHERS INN;Hotel;802;100;3500000;0;0.0000.00000.00000.;Jalan Menteri Supeno No.3A, Manahan, Banjarsari;BROTHERHOOD;Jalan Menteri Supeno No.3A, Manahan, Banjarsari;
A101.019;GRAND ORCHID HOTEL;cCustomer;GRAND ORCHID HOTEL;Hotel;802;100;300000;30;85.519.963.4-528.000;Jl. Adi Sucipto No. 43, Puspan, Blulukan, Karangayar;CV. JATI MAKMUR;Jl. Adi Sucipto No. 43, Puspan, Blulukan, Karangayar;
A101.075;FAVE HOTEL SOLO BARU (PT. DELTA MERLIN DUNIA PROPERTI);cCustomer;PT. DELTA MERLIN DUNIA PROPERTI;Hotel;802;100;5000000;0;0.0000.00000.00000.;"HARTONO TRADE CENTER LANTAI PI/LT.3 
 Jl. Ir. Soekarno No.10F, Dusun I, Madegondo, Grogol, Kabupaten Sukoharjo, Jawa Tengah 57552";EXECUTIVE KARAOKE;"HARTONO TRADE CENTER LANTAI PI/LT.3 
 Jl. Ir. Soekarno No.10F, Dusun I, Madegondo, Grogol, Kabupaten Sukoharjo, Jawa Tengah 57552";
A101.016;FAVE HOTEL ADISUTJIPTO (PT. DELTA MERLIN DUNIA PROPERTI);cCustomer;PT. DELTA MERLIN DUNIA PROPERTI;Hotel;802;100;50000000;14;0.0000.00000.00000.;THE PARK SOLO GROUND FLOUR;EXSELSO SOLO;THE PARK SOLO GROUND FLOUR;
A101.017;FRONT ONE HOTEL (PT. ADI SUMARMO ADI GUNA);cCustomer;PT. ADI SUMARMO ADI GUNA;Hotel;802;100;3000000;7;0.0000.00000.00000.;Jl. Adi Sucipto No.1 Paulan Wetan, Malangjiwan, Colomadu, Karanganyar;FOTO KOPI;Jl. Adi Sucipto No.1 Paulan Wetan, Malangjiwan, Colomadu, Karanganyar;
A101.018;FRONT ONE HOTEL SRAGEN (PT. WAW ANGKASA WIJAYA);cCustomer;PT. WAW ANGKASA WIJAYA;Hotel;802;100;1000000;7;0.0000.00000.00000.;JL PEMUDA UTARA 106KLATEN;FRAPIO KLATEN;JL PEMUDA UTARA 106KLATEN;
A101.021;GRAND LAGUNA;cCustomer;GRAND LAGUNA;Hotel;802;100;5000000;0;0.0000.00000.00000.;Jl. Yosodipuro no. 122, Mangkubumen Solo;GEROBAK PASTA;Jl. Yosodipuro no. 122, Mangkubumen Solo;
A101.071;GRAND MERCURE SOLO BARU (PT. DELTA MERLIN DUNIA PROPERTI);cCustomer;PT. DELTA MERLIN DUNIA PROPERTI;Hotel;802;100;100000000;30;0.0000.00000.00000.;JL. DR.RAJIMAN NO 263,JAYEGAN TIMUR PEREMPATAN PASAR KEMBANG KE KIRI;GRAINS & DOUGHT;JL. DR.RAJIMAN NO 263,JAYEGAN TIMUR PEREMPATAN PASAR KEMBANG KE KIRI;
A101.023;GRASS INN HOTEL SOLO;cCustomer;GRASS INN HOTEL SOLO;Hotel;802;100;5000000;30;0.0000.00000.00000.;JL. ADISUCIPTO 101SOLO;GRAND LAGUNA;JL. ADISUCIPTO 101SOLO;
A101.024;HARRIS HOTEL & CONVENTION SOLO (PT. CIPTA PROPERTI AGUNG);cCustomer;PT. CIPTA PROPERTI AGUNG;Hotel;802;100;70000000;0;0.0000.00000.00000.;"JL. ADISUCIPTO 1, MANAHAN SOLO 
 SEDERET DENGAN MOM MILK";HALLO SOLO RESTO;"JL. ADISUCIPTO 1, MANAHAN SOLO 
 SEDERET DENGAN MOM MILK";
A101.008;AZHIMA HOTEL BANDARA;cCustomer;AZHIMA HOTEL BANDARA;Hotel;802;100;5000000;28;0.0000.00000.00000.;Jl. Sutowijoyo No.39, Penumping, Laweyan, Kota Surakarta, Jawa Tengah 57141;IBU MUMU;Jl. Sutowijoyo No.39, Penumping, Laweyan, Kota Surakarta, Jawa Tengah 57141;
A101.025;KYRIAD ARRA HOTEL CEPU;cCustomer;KYRIAD ARRA HOTEL CEPU;Hotel;802;100;10000000;7;0.0000.00000.00000.;Solo Grand Mall Lt.3Solo;K PATATS;Solo Grand Mall Lt.3Solo;
A101.044;SAHID KUSUMA HOTEL (PT. KUSUMA SAHID);cCustomer;PT. KUSUMA SAHID;Hotel;802;100;300000;7;0.0000.00000.00000.;Jalan Raya Sukowati No.352, Sragen, Magero, Sragen Tengah, Kec. Sragen, Kabupaten Sragen, Jawa Tengah;KOPI SRAGEN;Jalan Raya Sukowati No.352, Sragen, Magero, Sragen Tengah, Kec. Sragen, Kabupaten Sragen, Jawa Tengah;
A101.027;LAMPION HOTEL (PT WISMA BINALOKA);cCustomer;PT. WISMA BINALOKA;Hotel;802;100;1000000;14;0.0000.00000.00000.;"JALAN ABDUL RAHMAN SHALEH 
 (SAMPING META FM)BARAT SOSCIL";LA CASETTA;"JALAN ABDUL RAHMAN SHALEH 
 (SAMPING META FM)BARAT SOSCIL";
A101.026;LOR IN HOTEL (PT. ANOM SOLO SARANATAMA);cCustomer;PT. ANOM SOLO SARANATAMA;Hotel;802;100;20000000;0;0.0000.00000.00000.;"LANTAI 2 Hotel ALILA SOLO 
 JLN. SLAMET RIYADI NO 562 RT 001, RW 001, LAWEYAN SURAKARTA";LIBERICA CAFE ALILA;"LANTAI 2 Hotel ALILA SOLO 
 JLN. SLAMET RIYADI NO 562 RT 001, RW 001, LAWEYAN SURAKARTA";
A101.069;MAHALAYA;cCustomer;MAHALAYA;Hotel;802;100;3000000;7;09.958.157.1-526;Jl. Menteri Supeno No.10, Manahan, Kec. Banjarsari, Kota Surakarta, Jawa Tengah 57139;MABAR & LAVINE;Jl. Menteri Supeno No.10, Manahan, Kec. Banjarsari, Kota Surakarta, Jawa Tengah 57139;
A101.029;MOVE MEGALAND HOTEL (PT. PAPAN REJEKI LESTARI);cCustomer;PT. PAPAN REJEKI LESTARI;Hotel;802;100;30000000;7;75.886.061.3532.000;JL,RAYA DUWET NO 1;MODUS CAFE;JL,RAYA DUWET NO 1;
A101.03;NOVOTEL SOLO HOTEL (PT. SUNINDO INDAH HOTEL);cCustomer;PT. SUNINDO INDAH HOTEL;Hotel;802;100;50000000;14;0.0000.00000.00000.;Solo Paragon, 02 Food Walk, Jl. Yosodipuro, Mangkubumen, Banjarsari, Kota Surakarta, Jawa Tengah;NIAGARA PARAGON;Solo Paragon, 02 Food Walk, Jl. Yosodipuro, Mangkubumen, Banjarsari, Kota Surakarta, Jawa Tengah;
A101.039;PREMIER INN SATORIA HOTEL (PT. SATORIA PRIMA PERSADA);cCustomer;PT. SATORIA PRIMA PERSADA;Hotel;802;100;5000000;0;0.0000.00000.00000.;Jl. Sumpah Pemuda No.101 Mojosongo Jebres Surakarta;PODJOK LAMPU;Jl. Sumpah Pemuda No.101 Mojosongo Jebres Surakarta;
A101.038;PRIMA INN HOTEL;cCustomer;PRIMA INN HOTEL;Hotel;802;100;500000;0;0.0000.00000.00000.;"Jl. Adi Sucipto No.29 Kerten Laweyan Surakarta 
 POM BENSIN MANAHAN";POLAR BEAR;"Jl. Adi Sucipto No.29 Kerten Laweyan Surakarta 
 POM BENSIN MANAHAN";
A101.006;ALILA HOTEL SOLO (PT. NARENDRA LENTERA ADISAKTI);cCustomer;PT. NARENDRA LENTERA ADISAKTI;Hotel;802;100;200000000;30;31.339.464.5-526.000;JL.SLAMET RIYADI 562 RT 001 RW 001, JAJAR, LAWEYAN, SURAKARTA;PT NARENDRA LENTERA ADISAKTI;JL.SLAMET RIYADI 562 RT 001 RW 001, JAJAR, LAWEYAN, SURAKARTA;
A101.053;SOLIA ZIGNA HOTEL (PT.HAILAI SINAR CEMERLANG);cCustomer;PT.HAILAI SINAR CEMERLANG;Hotel;802;100;5000000;0;02.581.133.2-526.000;JL. SLAMET RIYADI NO.205 RT 001 RW 006 KEMLAYAN, SERENGAN, SURAKARTA;PT TRI KUSUMA SANTOSA;JL. SLAMET RIYADI NO.205 RT 001 RW 006 KEMLAYAN, SERENGAN, SURAKARTA;
A115.027;INTERNATIONAL HOTEL MANAGEMENT HOTEL SOLO;cCustomer;INTERNATIONAL HOTEL MANAGEMENT HOTEL SOLO;Hotel;802;100;5000000;0;74.967.806.6-526.000;KAWASAN Hotel ALILA, JALAN SLAMET RIYADI NO.562 RT.001 RW.001 JAJAR, LAWEYAN SURAKARTA JAWA TENGAH 57141;PT. CIPTA REJEKI BERSAMA;KAWASAN Hotel ALILA, JALAN SLAMET RIYADI NO.562 RT.001 RW.001 JAJAR, LAWEYAN SURAKARTA JAWA TENGAH 57141;
A101.005;ALANA SOLO (PT. DELTA MERLIN DUNIA PROPERTI);cCustomer;PT. DELTA MERLIN DUNIA PROPERTI;Hotel;802;100;350000000;30;02.014.215.4-528.001;Jl. Adi Sucipto, Blulukan, Blulukan, Kec. Colomadu, Kabupaten Karanganyar, Jawa Tengah;PT. DELTA MERLIN DUNIA PROPERTI;Jl. Adi Sucipto, Blulukan, Blulukan, Kec. Colomadu, Kabupaten Karanganyar, Jawa Tengah;
A101.002;AMARELLO HOTEL (PT. GUNTUR MADU TAMA);cCustomer;PT. GUNTUR MADU TAMA;Hotel;802;100;10000000;28;01.357.450.4-526.001;JL.GATOT SUBROTO NO 89 - 103DEPAN SINGOSAREN PLAZA SURAKARTA;PT. GUNTUR MADU TAMA;JL.GATOT SUBROTO NO 89 - 103DEPAN SINGOSAREN PLAZA SURAKARTA;
A101.05;SYARIAH LOR IN HOTEL;cCustomer;SYARIAH LOR IN HOTEL;Hotel;802;100;1000000;28;01.781.372.6-046.000;GEDUNG PERKANTORAN BIDAKARA 2 LT. 19 - 22 JLN. JENDRAL GATOT SUBROTO KAV. 71 - 73 MENTENG DALAM - TEBETJAKARTA SELATAN - DKI JAKARTA 12870;PT. LION SUPER INDO;GEDUNG PERKANTORAN BIDAKARA 2 LT. 19 - 22 JLN. JENDRAL GATOT SUBROTO KAV. 71 - 73 MENTENG DALAM - TEBETJAKARTA SELATAN - DKI JAKARTA 12870;
A101.001;AGAS INTERNATIONAL HOTEL (PT. NIKI SAMI MULYA INDAH);cCustomer;PT. NIKI SAMI MULYA INDAH;Hotel;802;100;0;28;02.951.089.8-526.000;Jl. Dr. Muwardi No.44Solo;PT. NIKI SAMI MULYA INDAH;Jl. Dr. Muwardi No.44Solo;
A101.009;ALLIUM CEPU HOTEL (PT.GO CELL INTERNATIONAL);cCustomer;PT.GO CELL INTERNATIONAL;Hotel;802;100;10000000;28;03.101.263.6-514.001;Jalan By Pass Cepu, Balun, Cepu, Megal, Balun, Blora, Kabupaten Blora,;PT.GO CELL INTERNATIONAL;Jalan By Pass Cepu, Balun, Cepu, Megal, Balun, Blora, Kabupaten Blora,;
A101.045;SOLO INN HOTEL;cCustomer;SOLO INN HOTEL;Hotel;802;100;500000;28;03.196.092.5-526.000;Jl. Dr. Rajiman No.525, Laweyan, Kec. Laweyan, Kota Surakarta,;PT.HAILAI SINAR CEMERLANG;Jl. Dr. Rajiman No.525, Laweyan, Kec. Laweyan, Kota Surakarta,;
A101.01;ALLURA AZANA RESORT (PT. UNGGUL RESIR CEMERLANG);cCustomer;PT. UNGGUL RESIR CEMERLANG;Hotel;802;100;20000000;30;41.488.480.9-528.000;KALISORO RT003 RW003,KELURAHAN KALISOLO KEC.TAWANGMANGU KAB.KARANGANYAR;PT.UNGGUL RESIR CEMERLANG;KALISORO RT003 RW003,KELURAHAN KALISOLO KEC.TAWANGMANGU KAB.KARANGANYAR;
A101.043;RAMADA SWITES HOTEL;cCustomer;RAMADA SWITES HOTEL;Hotel;802;100;10000000;14;67.949.477.3-542.000;Perum Queen Garden III Blok F0, Dusun II, Waru, Baki, Kabupaten Sukoharjo, Jawa Tengah;QUEEN PIZZA;Perum Queen Garden III Blok F0, Dusun II, Waru, Baki, Kabupaten Sukoharjo, Jawa Tengah;
A101.042;ROEMAH KOE HOTEL;cCustomer;ROEMAH KOE HOTEL;Hotel;802;100;1000000;30;0.0000.00000.00000.;JL.SENDANG LAWE DUSUN 3 KARANGGENENG KEC BOYOLALI;RESWARA;JL.SENDANG LAWE DUSUN 3 KARANGGENENG KEC BOYOLALI;
A115.049;RS. INDRIATI (PT.DELTA MERLIN);cCustomer;PT. DELTA MERLIN;Hotel;802;100;10000000;7;0.0000.00000.00000.;Solo;RILASSATI KITCHEN AND PASTRY;Solo;
A102.229;RUMAH AT SIRI;cCustomer;RUMAH AT SIRI;Hotel;802;100;90000000;0;73.368.741.2-528.000;"Jl. Solo - Purwodadi Dusun 1 Gemolong 
 Kec. Gemolong Kabupaten Sragen";RISMA;"Jl. Solo - Purwodadi Dusun 1 Gemolong 
 Kec. Gemolong Kabupaten Sragen";
A101.041;RUMAH BOEDI RESIDANCE VILLA BOROBUDUR;cCustomer;RUMAH BOEDI RESIDANCE VILLA BOROBUDUR;Hotel;802;100;0;0;0.0000.00000.00000.;"Jl. A. Yani No.310 
 (Dkt Terminal Tirtonadi) 
 Solo";ROCKET;"Jl. A. Yani No.310 
 (Dkt Terminal Tirtonadi) 
 Solo";
A115.007;SAHID RAYA (PT. SAHID & CO);cCustomer;PT. SAHID & CO;Hotel;802;100;2000000;0;0.0000.00000.00000.;Yogyakarta;Rumah Makan Wonosari;Yogyakarta;
A101.034;SOLO PARAGON HOTEL RESIDENCE (PT. SUNINDO GAPURA PRIMA);cCustomer;PT. SUNINDO GAPURA PRIMA;Hotel;802;100;50000000;0;0.0000.00000.00000.;Jl. Gajah Mada No.47 B, Punggawan, Banjarsari, Kota Surakarta, Jawa Tengah 57132, Indonesia;SOLO BAKERY;Jl. Gajah Mada No.47 B, Punggawan, Banjarsari, Kota Surakarta, Jawa Tengah 57132, Indonesia;
A101.051;SWISS-BELL HOTEL SOLO (PT. DELTA MERLIN DUNIA PROPERTI);cCustomer;PT. DELTA MERLIN DUNIA PROPERTI;Hotel;802;100;100000000;7;0.0000.00000.00000.;"JLN. MELATI NO. 5A 
 SOLO (BELAKANG RS. KASIH IBU)";SUNRISE;"JLN. MELATI NO. 5A 
 SOLO (BELAKANG RS. KASIH IBU)";
A101.049;SWISS BELL INN SARIPETOJO (PT. SOLO REGENCY HOTEL);cCustomer;PT. SOLO REGENCY HOTEL;Hotel;802;100;500000000;30;74.130.862.1-526.000;Food Court Lt. 2 Solo Grand MallJL. Slamet Riyadi Street No.273, Penumping, Laweyan, Surakarta;SUPER CHICKEN SGM;Food Court Lt. 2 Solo Grand MallJL. Slamet Riyadi Street No.273, Penumping, Laweyan, Surakarta;
A101.007;THE ADHIWANGSA HOTEL SOLO;cCustomer;THE ADHIWANGSA HOTEL SOLO;Hotel;802;100;50000000;30;0.0000.00000.00000.;Jl. Adi Sucipto No.47 Blulukan Colomadu;Syariah Lor Inn;Jl. Adi Sucipto No.47 Blulukan Colomadu;
A101.064;THE SUNAN HOTEL (PT. GRAHAMULYA WIRASTAMA);cCustomer;PT. GRAHAMULYA WIRASTAMA;Hotel;802;100;200000000;0;0.0000.00000.00000.;JL.SLAMET RIYADI JOHOSARI GAYAM KEC SUKOHARJO;TAT'S HOUSE;JL.SLAMET RIYADI JOHOSARI GAYAM KEC SUKOHARJO;
A101.055;ZEST HOTEL SOLO (PT. BUMI HARAPAN INDAH);cCustomer;PT. BUMI HARAPAN INDAH;Hotel;802;100;1000000;0;0.0000.00000.00000.;Jl. Abdul Muis no. 21 Setabelan Solo;Xin-Xin Restaurant;Jl. Abdul Muis no. 21 Setabelan Solo;
A114.093;ADLER KAFFEE;cCustomer;ADLER KAFFEE;Coffee Shop;829;120;10000000;0;0.0000.00000.00000.;Jl. Mertolulutan No.30, Purwodiningratan, Kec. Jebres, Kota Surakarta, Jawa Tengah 57128;ADLER KAFFE;Jl. Mertolulutan No.30, Purwodiningratan, Kec. Jebres, Kota Surakarta, Jawa Tengah 57128;
A114.001;AJAR NGOPI;cCustomer;AJAR NGOPI;Coffee Shop;829;120;1000000;30;0.0000.00000.00000.;JL. DOKTOR SUTOMO NO 21 A PENUMPING;AJAR NGOPI;JL. DOKTOR SUTOMO NO 21 A PENUMPING;
A102.047;ALMAMATER;cCustomer;ALMAMATER;Coffee Shop;829;120;1000000;0;0.0000.00000.00000.;Jl. Ir. Sutami No.32, Jebres, Kec. Jebres, Kota Surakarta, Jawa Tengah 57126;ALMAMATER;Jl. Ir. Sutami No.32, Jebres, Kec. Jebres, Kota Surakarta, Jawa Tengah 57126;
A114.008;BABE'S COFFEE;cCustomer;BABE'S COFFEE;Coffee Shop;829;120;1000000;30;0.0000.00000.00000.;JL. KAPTEN MULYADI NO 115PASAR KLIWONSURAKARTA - 57113;AZIZA Hotel;JL. KAPTEN MULYADI NO 115PASAR KLIWONSURAKARTA - 57113;
A114.09;BABRAK SPACE;cCustomer;BABRAK SPACE;Coffee Shop;829;120;10000000;60;0.0000.00000.00000.;KARANGANYAR;AZKAYRA FROZEN;KARANGANYAR;
A102.054;BERANDA RUMAH;cCustomer;BERANDA RUMAH;Coffee Shop;829;120;5000000;7;69.614.397.3-528.000;JALAN PAKEL NO NO 40 BELAKANG FAVE HotelMANAHAN SOLO;BEE SQUARE;JALAN PAKEL NO NO 40 BELAKANG FAVE HotelMANAHAN SOLO;
A114.011;BENOWO KOPI;cCustomer;BENOWO KOPI;Coffee Shop;829;120;1000000;0;0.0000.00000.00000.;JL.RAYA SOLO BAKI NO A5 SUKOHARJO JAWA TENGAH;BEEF BRO;JL.RAYA SOLO BAKI NO A5 SUKOHARJO JAWA TENGAH;
A114.007;BLACKBIRD COFFEE;cCustomer;BLACKBIRD COFFEE;Coffee Shop;829;120;1000000;0;0.0000.00000.00000.;Jl. Adi Sucipto No.154, Blulukan, Colomadu;BIG BRO;Jl. Adi Sucipto No.154, Blulukan, Colomadu;
A114.012;BLACK BIRD COFFE SOLO;cCustomer;BLACK BIRD COFFE SOLO;Coffee Shop;829;120;1000000;0;0.0000.00000.00000.;JL. ADI SUMARMO NO 196, SAWAH GEDONGAN, KEC . COLOMADU , KABUPATEN KARANGANYAR. 557173;BLACK ARION;JL. ADI SUMARMO NO 196, SAWAH GEDONGAN, KEC . COLOMADU , KABUPATEN KARANGANYAR. 557173;
A114.096;BLACKBIRD PALUR;cCustomer;BLACKBIRD PALUR;Coffee Shop;829;120;1000000;14;0.0000.00000.00000.;Jl. Gatot Subroto No.35, Singosaren, Kemlayan, Serengan;BLACKBIRD COFFEE;Jl. Gatot Subroto No.35, Singosaren, Kemlayan, Serengan;
A114.095;MRCL COFFE STUDIO;cCustomer;MRCL COFFE STUDIO;Coffee Shop;829;120;5000000;0;0.0000.00000.00000.;SOLO;BRIAN;SOLO;
A102.055;BURGER DAN KOPI LAWE;cCustomer;BURGER DAN KOPI LAWE;Coffee Shop;829;120;5000000;0;0.0000.00000.00000.;SOLO;BU NOVI;SOLO;
A114.002;BUTLER COFFEE BOUTIQUE;cCustomer;BUTLER COFFEE BOUTIQUE;Coffee Shop;829;120;1000000;0;0.0000.00000.00000.;JLN. LATAR IRENG BARENGKLATEN;BU RATIH - PARU;JLN. LATAR IRENG BARENGKLATEN;
A114.014;CAFE AT EDEN;cCustomer;CAFE AT EDEN;Coffee Shop;829;120;50000000;0;35.248.257.4.526.000;"Jl. Perintis Kemerdekaan, Purwosari, Kec. Laweyan, Kota Surakarta, Jawa Tengah 57147 
 (KOPI LAWE)";BURGER LAWE;"Jl. Perintis Kemerdekaan, Purwosari, Kec. Laweyan, Kota Surakarta, Jawa Tengah 57147 
 (KOPI LAWE)";
A114.013;CAFE MILLENIAL;cCustomer;CAFE MILLENIAL;Coffee Shop;829;120;1000000;30;80.039.843.0-526.000;Jl. Ronggowarsito No.171, Timuran, Kec. Banjarsari, Kota Surakarta, Jawa Tengah 57131;Butler Coffee Boutique;Jl. Ronggowarsito No.171, Timuran, Kec. Banjarsari, Kota Surakarta, Jawa Tengah 57131;
