ITEM CODE;NAMA ITEM;BIAYA LAYANAN 2023;ServiceFee
EID3KEW037;KEWPIE HONEY MUSTARD SAUCE;0.0310;3.1
EID2KEW008;KEWPIE JAPANESE CURRY SAUCE;0.0310;3.1
EID3KEW013;KEWPIE SUSHI SEASONING;0.0310;3.1
EID3KEW011;KEWPIE YOGHURT MAYO;0.0310;3.1
FID3KEW016;KEWPIE GRATED ONION;0.0310;3.1
EID2KEW009;KEWPIE EGG MAYO;0.0310;3.1
AID2OLS078;Daging Slice Murah - Untuk Shabu Shabu dan Yakiniku;0.0310;3.1
EID3KEW033;KEWPIE NANBAN SAUCE;0.0310;3.1
EID2KEW006;KEWPIE GOCHUJANG KOREAN SAUCE;0.0310;3.1
EID3KEW021;KEWPIE ONION & MAYO MAYONNAISE;0.0310;3.1
EIT3DEC040;DE CECCO SUGO ALLA' NAPOLETANA - PASTA TOMATO SAUCE;0.0310;3.1
EIT3DEC039;DE CECCO SUGO ALL'ARRABBIATA - PASTA TOMATO SAUCE;0.0310;3.1
AID2OLS088;Pomosi Akhir Tahun - Daging Sapi Murah 1Kg;0.0310;3.1
AID2LOC084;AUS RIBEYE GRAIN FED PRIME CUT STEAK 300GR;0.0310;3.1
AID2LOC083;AUS RIBEYE GRAIN FED PRIME CUT STEAK 200GR;0.0310;3.1
AID2LOC082;WAGYU RIBEYE GRASS FED HORMONE & ANTIBIATIC FREE MB5 CUT STEAK 300GR;0.0310;3.1
AID2LOC081;WAGYU TOPSIDE MB 9+ BLACKMORE CUT YAKINIKU 250GR;0.0310;3.1
AID2LOC080;WAGYU STRIPLOIN MB 4-5 HORMONE & ANTIBIOTIC FREE CUT STEAK 300GR;0.0310;3.1
BID2IGU109;BAKSO AYAM REGULAR 1 KG / REGULAR CHICKEN MEATBALL;0.0310;3.1
BID2IGU128;BAKSO SAPI REGULAR 1 KG/ REGULAR MEATBALL;0.0310;3.1
GCN2XJR010;MIXED PEPPER (PAPRIKA) SLICE 1 KG;0.0310;3.1
GCN2XJR009;SHITAKE MUSHROOM SLICE 1KG;0.0310;3.1
AID2LOC078;DAGING SOP IGA 250GR - US SHORT RIB B/IN;0.0310;3.1
BID2IGU129;CHICKEN SAUSAGE REGULAR 1KG - SOSIS AYAM REGULER;0.0310;3.1
EIT3DEC016;DE CECCO CONCHIGLIE RIGATE 500GR;0.0310;3.1
EKR3BAN007;BAN-DARAN BLACK SESAME PORRIDGE;0.0310;3.1
EKR3BAN005;BAN-DARAN SWEET PUMPKIN PORRIDGE;0.0310;3.1
EKR3BAN008;BAN-DARAN SWEET RED BEAN PORRIDGE;0.0310;3.1
EKR3BAN006;BAN-DARAN NUTS PORRIDGE;0.0310;3.1
FIT3SAL001;SALVADORI EXTRA VIRGIN OLIVE OIL 1 Liter dari Italia ;0.0310;3.1
AID2OLS126;NZ Ribeye GF Slice Shabu-shabu 250 GR *FLASH SALE*;0.0310;3.1
AID2LOC075;AUS STRIPLOIN ORGANIC HORMONE & ANTIBIOTIC FREE 200GR *FLASH SALE*;0.0310;3.1
AID2OLS057;US Ribeye Lip On Prime cut Steak 200 GR *Flash Sale*;0.0310;3.1
AID2LOC077;RIBEYE REGULAR BEEF SLICE SHABU 250GR;0.0310;3.1
GID2LOC001;KENTANG TATER ROUNDABOUTS/HASHBROWN 250GR;0.0310;3.1
AID2OLS001;US Shortplate Beef Slice /pack +-500 Gram *FLASH SALE*;0.0310;3.1
FIT3IFF008;HULALA ITALIAN BECHAMEL/BESCIAMELLA CREAM 200ML;0.0310;3.1
AID2LOC075;AUS STRIPLOIN ORGANIC HORMONE & ANTIBIOTIC FREE CUT STEAK 200GR;0.0310;3.1
AID2LOC076;AUS RIBEYE ORGANIC HORMONE & ANTIBIOTIC FREE CUT STEAK 200GR;0.0310;3.1
AID2LOC072;DAGING GILING REGULAR 250GR/ GROUND BEEF REGULAR 250GR;0.0310;3.1
EIT3GFL016;SPAGHETTI - GAROFALO PASTA 500GR;0.0310;3.1
AID2LOC073;US CHUCK EYE ROLL PRIME CUT YAKINIKU 250GR;0.0310;3.1
AID2OLS077;US CHUCK EYE ROLL PRIME CUT SHABU 250GR;0.0310;3.1
AID2LOC074;US RIBEYE ROLL NR BLACK ANGUS CUT STEAK 250GR;0.0310;3.1
FUS3FIS011;ABC SNACKS PIZZA BALLS 85GR;0.0380;3.8
FUS3FIS009;ABC SNACK CHEESE BALL 85GR;0.0380;3.8
AID2LOC071;WAGYU CHUCK TENDER MB 8-9 CUT SHABU 250GR;0.0310;3.1
AID2LOC070;WAGYU RUMP CAP MB 4-5 CUT STEAK 150GR;0.0310;3.1
AID2LOC061;US TRI TIP PRIME CUT STEAK 150 GR;0.0310;3.1
FIT3IFF004;HULALA ITALIAN PRISTINE COOKING GRAN CUCINA 1L;0.0310;3.1
FIT3IFF009;HULALA ITALIAN WHIPPING CREAM SPRAY 250GR;0.0310;3.1
FIT3IFF003;HULALA ITALIAN WHIPPING CREAM (varian 200ml, 500ml, 1l);0.0310;3.1
FIT3IFF001;;0.0310;3.1
FIT3IFF002;;0.0310;3.1
DNO2FOS001;NORWEGIAN SMOKE TROUT SLICED 1.1KG UP;0.0310;3.1
AID2LOC057;AUS TENDERLOIN SLICED SHABU 250GR;0.0310;3.1
BID2IGU144;EL PRIMO Veal Bratwurst Sausage 500GR;0.0310;3.1
AID2LOC059;AUS PREMIUM RIBEYE MB4 CUT STEAK 300GR;0.0310;3.1
AID2LOC060;AUS STRIPLOIN PREMIUM MB 2+ PINACLE HORMONE ANTIBIOTIC FREE - 200GR;0.0310;3.1
AID2OLS078;US SHORT RIB B/IN CUT CUBE 500GR;0.0310;3.1
DID2MML011;IKAN DORI FILLET 1KG;0.0310;3.1
BID2IGU103;EL PRIMO BEEF RASHER/ DAGING SAPI ASAP 500GR;0.0310;3.1
AID2LOC058;DAGING GILING 1KG/ GROUND BEEF REGULAR 1KG;0.0310;3.1
AID2LOC055;PARU 1 KG / DAGING PARU SAPI 1 KG;0.0310;3.1
GID2TAS004;TASTY FRIES SHOESTRING PLAIN 900GR/ KENTANG GORENG BEKU SHOESTRING;0.0310;3.1
AID2LOC054;WAGYU RIBEYE CAP MB 4 CUT STEAK 150GR;0.0310;3.1
AID2OLS093;AUS RUMP CAP PICANHA CUT STEAK 150GR END CUT;0.0310;3.1
AID2LOC053;AUS CHUCK CREST GRADE S CUT SHABU 250GR;0.0310;3.1
EKR3NUT005;NUTS HOLIC ALMOND HOT & SPICY 240GR;0.0380;3.8
EKR3NUT003;NUTS HOLIC ALMOND STRAWBERRY 240 GR (BOX);0.0380;3.8
EKR3NUT001;NUTS HOLIC ALMOND HONEY BUTTER 240 GR (BOX);0.0380;3.8
EIT3BAL006;BALCONI WAFER VANILLA 175 GR - INDOGUNA;0.0380;3.8
EIT3BAL004;BALCONI WAFER CHOCOLATE 175 GR - INDOGUNA;0.0380;3.8
EIT3BAL005;BALCONI WAFER HAZELNUT 175 GR - INDOGUNA;0.0380;3.8
EKR3NUT002;NUTS HOLIC ALMOND HOT & SPICY 180GR;0.0380;3.8
EKR3NUT001;NUTS HOLIC ALMOND HONEY BUTTER 180GR;0.0380;3.8
EKR3NUT003;NUTS HOLIC ALMOND STRAWBERRY 180GR;0.0380;3.8
DID2WBS010;SEA COLD SMALL SHRIMP/PRAWN/UDANG KECIL SEA COLD FROZEN 1 KG- INDOGUNA;0.0310;3.1
DID2WBS008;SEA COLD SHRIMP/PRAWN/UDANG SEA COLD BESAR FROZEN 1 KG - INDOGUNA;0.0310;3.1
DID2MML006;TUNA SAKU 300-380GR - INDOGUNA;0.0310;3.1
DID2OLS002;SALMON FILLET CUT 200GR;0.0310;3.1
AID2OLS144;AUS WAGYU DECKLE BLACK ANGUS MB 4 CUT SHABU 250 GR - INDOGUNA;0.0310;3.1
AID2OLS145;AUS WAGYU DECKLE BLACK ANGUS MB 4 CUT YAKINIKU 250 GR - INDOGUNA;0.0310;3.1
GID2OLS006;TATER PUFF INDOGUNA 500 GR;0.0310;3.1
GID2OLS005;HASHBROWN INDOGUNA 500GR;0.0310;3.1
AID2OLS123;US Short Rib Boneless Cut Shabu 250 Gr - Indoguna;0.0310;3.1
AID2OLS143;AUS VEAL HINDSHANK 500G;0.0310;3.1
AID2OLS142;NZ STRIPLOIN PS GRASS FED HORMONE&ANTIBIOTIC FREE SLICE SHABU 250GR;0.0310;3.1
AID2OLS141;DAGING SOP PENGGANTI BUNTUT/OXTAIL 500GR;0.0310;3.1
AID2OLS132;AUS RIBEYE GRAIN FED BACHELOR CUT STEAK 200GR - Indoguna;0.0310;3.1
AID2OLS133;NZ PS Striploin MB 4+ Premium Wet Aged 55 Days Slice Shabu - Indoguna;0.0310;3.1
AID2OLS140;AUS BRISKET NE S SLICE SHABU 250GR - Indoguna;0.0310;3.1
AID2OLS134;AUS WAGYU SHORT RIB BONELESS MB 3 CUT SHABU 250GR - INDOGUNA;0.0310;3.1
AID2OLS125;JAPANESE WAGYU CHUCK EYE ROLL A4 MB 6 SLICE SHABU 150GR - INDOGUNA;0.0310;3.1
AID2OLS124;JAPANESE WAGYU CHUCK EYE ROLL A4 MB 6 CUT YAKINIKU 150GR - INDOGUNA;0.0310;3.1
AID2OLS138;NZ TENDERLOIN GRASS FED HORMONE & ANTIBIOTIC FREE -Indoguna;0.0310;3.1
AID2OLS139;NZ RIBEYE GROUND BEEF HORMONE & ANTIBIOTIC FREE 500GR - Indoguna;0.0310;3.1
AID2OLS129;AUS Wagyu Striploin MB4 Shabu-shabu 250gr - Indoguna;0.0310;3.1
AID2OLS136;AUS Wagyu Striploin MB4 Shabu-shabu 250gr - Indoguna;0.0310;3.1
AID2OLS128;AUS Striploin Wagyu MB4 Cut Steak 200gr - Indoguna;0.0310;3.1
AID2OLS126;NZ Ribeye GF Slice Shabu-shabu 250 gr - Indoguna;0.0310;3.1
AID2OLS135;NZ Shortplate Slice Shabu-shabu 250gr - Indogun;0.0310;3.1
AID2LOC042;AUS Wagyu Saikoro 500 Gr - Indoguna;0.0310;3.1
ESG3KOK036;KOKA Multigrain Noodles Purple Corn Pepper Crab Flavour- Indoguna;0.0310;3.1
ESG3KOK035;KOKA Multigrain Noodles Purple Corn Hot Mala Tofu Flavour- Indoguna;0.0310;3.1
ESG3KOK034;KOKA Multigrain Noodles Purple Five Spiced Duck Flavour- Indoguna;0.0310;3.1
AID2OLS121;AUS Wagyu Ground Beef / Daging Giling Sapi Wagyu 500 Gr - Indoguna;0.0310;3.1
AID2OLS118;US Inside Round Low Fat (Rendah Lemak) Cut Yakiniku 250 Gr - Indoguna;0.0310;3.1
AID2OLS117;US Inside Round Low Fat (Rendah Lemak) Cut Shabu 250 Gr - Indoguna;0.0310;3.1
AID2OLS111;US Shortloin Choice Porterhouse 750 Gr - Indoguna;0.0310;3.1
HBE3CDM004;COUNTRE Strawberry Milk / Susu Rasa Stroberi 500 Ml - Indoguna;0.0310;3.1
HBE3CDM002;COUNTRE Chocolate Milk / Susu Rasa Cokelat 500 Ml - Indoguna;0.0310;3.1
AID2OLS119;AUS Chuck Roll Cut Shabu 250 Gr - Indoguna;0.0310;3.1
AID2OLS120;US Chuck Short Rib Bone Less Prime Cut Karubi 250 Gr- Indoguna;0.0310;3.1
AID2OLS078;AUS Short Rib Bone In Center Cut 3x3 cm Cube - Indoguna;0.0310;3.1
AID2OLS116;AUS Cheek Meat 900 Gr - Indoguna;0.0310;3.1
AID2OLS109;US Ribeye Choice Cut Yakiniku 250 Gr - Indoguna;0.0310;3.1
AID2OLS110;US Ribeye Choice Cut Shabu 250 Gr - Indoguna;0.0310;3.1
AID2OLS112;US Shortloin Choice T Bone 750 Gr - Indoguna;0.0310;3.1
FES3LAR006;Extra Virgin Olive Oil - Special Coupage LA RAMBLA 3 Liter - Indoguna;0.0310;3.1
AID2OLS114;AUS Lamb Rack MULWARRA Cut 500 Gr - Indoguna;0.0310;3.1
AID2OLS113;AUS Lamb Rack THOMAS FOODS Cut 500 Gr - Indoguna;0.0310;3.1
AID2OLS115;AUS Wagyu Topside MB 9+ BLACKMORE Fullblood Wagyu Cut 250 Gr -Indoguna;0.0310;3.1
AID2OLS106;US Short Rib Boneless Cut Yakiniku 250 Gr - Indoguna;0.0310;3.1
AID2OLS124;AUS Blade Cut Yakiniku - Daging Slice Yakiniku Blade AUS (Flash Sale);0.0310;3.1
AID2OLS097;NZ Striploin Grass Fed Cut Steak 200 Gr - Indoguna;0.0310;3.1
FIT3SAL003;Pomace Olive Oil SALVADORI 5 Liter dari Italia - Indoguna;0.0310;3.1
BID2IGU116;EL PRIMO Sosis Ayam Frankfurter / Chicken Frankfurter - Indoguna;0.0310;3.1
BID2IGU157;EL PRIMO Sosis Ayam / Chicken Picnic - Indoguna;0.0310;3.1
AID2OLS102;AUS Intercostal Cut Sate 500 Gr - Indoguna;0.0310;3.1
AID2OLS108;AUS Beef Liver / Hati Sapi 1 Kg - Indoguna;0.0310;3.1
AID2OLS105;AUS Shortloin A T Bone 500 Gr - Indoguna;0.0310;3.1
AID2OLS103;AUS Shortloin A Porterhouse 500 Gr - Indoguna;0.0310;3.1
AID2OLS095;AUS Striploin A Grass Fed Cut Yakiniku 250 Gr - Indoguna;0.0310;3.1
AID2OLS099;AUS Wagyu T bone MB 6 - Cut 750 Gr - Indoguna;0.0310;3.1
AID2OLS107;NZ Striploin PS Grass Fed Cut Steak 200 Gr - Indoguna;0.0310;3.1
AID2OLS100;NZ Striploin PR Grass Fed Cut Steak 200 Gr - Indoguna;0.0310;3.1
AID2OLS101;NZ Ribeye Grass Fed Cut Steak 200 Gr - Indoguna;0.0310;3.1
BID2IGU067;EL PRIMO Bakso Sapi Urat Premium 750 Gr - Indoguna;0.0310;3.1
BID2IGU122;EL PRIMO Sosis Sapi Frankfurter / Beef Frankfurter - Indoguna;0.0310;3.1
BID2IGU158;EL PRIMO Sosis Sapi / Beef Picnic - Indoguna;0.0310;3.1
BID2IGU124;EL PRIMO Sosis Sapi Bratwurst / Beef Bratwurst - Indoguna;0.0310;3.1
BID2IGU035;EL PRIMO Sosis Sapi Wagyu / Wagyu Sausage - Indoguna;0.0310;3.1
IUS2NAT009;Natalie's Tangerine Juice Fresh Frozen 250 Ml - Indoguna;0.0250;2.5
IUS2NAT008;Natalie's Orange Juice Fresh Frozen 250 Ml - Indoguna;0.0250;2.5
IUS2NAT005;Natalie's Orange Beet Juice Fresh Frozen;0.0250;2.5
HID4MLF001;MILK LIFE Fresh Milk / Susu Segar MILK LIFE ( Promo ) - Indoguna;0.0310;3.1
AID2OLS096;AUS MULWARRA Black Angus Striploin Hormone & Antibiotic Free-Cut 200Gr;0.0310;3.1
AID2OLS098;AUS Wagyu Porterhouse MB 6 - Cut 750 Gr - Indoguna;0.0310;3.1
AID2OLS094;AUS Shortplate Beef Slice / Daging Sapi Slice 250 GR - INDOGUNA;0.0310;3.1
AID2OLS066;AUS Striploin A Sliced Beef - Daging Sapi Sliced Striploin A / 250 GR;0.0310;3.1
AID2OLS092;NZ PS Striploin MB 4+ Premium Wet Aged 55 Days - Indoguna;0.0310;3.1
AID2OLS093;AUS Rump Cap Picanha Steak - Indoguna;0.0310;3.1
AID2OLS084;Daging Kerbau Knuckle 1 KG - Indoguna;0.0310;3.1
AID2OLS082;Daging Kerbau Tipe 2 - 1 KG - Indoguna;0.0310;3.1
AID2OLS089;Daging sapi untuk Sop / Soup 1 KG - Indoguna;0.0310;3.1
AID2OLS090;Daging Sapi Gandik Eye Round 1 KG - Indoguna;0.0310;3.1
EID1MIU003;Kimchi Halal 600 Gr;0.0250;2.5
HSG1EMM017;EMMI Swiss Premium UHT Milk 1Liter;0.0310;3.1
AID2OLS081;Daging Sapi Outside Potongan Teriyaki 500 GR - Indoguna;0.0310;3.1
AID2OLS080;Daging Sapi Outside Potongan Sukiyaki 500 GR - Indoguna;0.0310;3.1
AID2OLS079;Daging Sapi Outside Potongan Rendang 1 KG - Indoguna;0.0310;3.1
AID2OLS088;Daging sapi Chuck - Sampil 1 KG - Indoguna;0.0310;3.1
AID2OLS087;Daging Sapi Knuckle 1 KG - Indoguna;0.0310;3.1
AID2OLS086;Daging Sapi Outside 1 KG - Indoguna;0.0310;3.1
AID2OLS078;AUS SHORTPLATE CAP SLICE / DAGING SAPI SLICE 250Gr - INDOGUNA;0.0310;3.1
AID2OLS077;US CHUCK EYE ROLL SLICE - DAGING SAPI SLICE 250 Gr - INDOGUNA;0.0310;3.1
AID2OLS076;US RIB EYE SLICE - DAGING SLICE RIB EYE 250Gr - INDOGUNA;0.0310;3.1
AID2OLS075;Shortplate End - Daging Slice 250Gr - Indoguna;0.0310;3.1
BID2IGU138;Sosis Sapi Spiral Indoguna / Beef Spiral Sausage Indoguna;0.0310;3.1
BID2IGU062;Sosis Ayam Spiral Indoguna / Chicken Spiral Sausage Indoguna;0.0310;3.1
BID2IGU134;Sosis Sapi Frankfurter Diet Keto Indoguna;0.0310;3.1
BID2IGU137;Sosis Sapi Diet Keto Indoguna;0.0310;3.1
EFR3ABY005;Abbaye French Butter Cookies Milk Chocolate 135 GR - Indoguna;0.0380;3.8
EFR3ABY006;Abbaye Chocoladises Milk Chocolate Biskuit 135 GR - INDOGUNA;0.0380;3.8
EFR3ABY007;Abbaye Chocoladises Dark Chocolate Biskuit 135 GR - INDOGUNA;0.0380;3.8
FID3PRO012;Pro Steak Yakiniku Sauce 250ml - Indoguna;0.0310;3.1
FID3PRO011;Pro Steak Teriyaki Sauce 250ml - Indoguna;0.0310;3.1
FID3PRO010;Pro Steak Shitake Mushroom Sauce 250ml - Indoguna;0.0310;3.1
FID3PRO008;Pro Steak Ponzu Sauce 250ml - Indoguna;0.0310;3.1
FID3PRO009;Pro Steak 'Steak' Sauce 250ml - Indoguna;0.0310;3.1
FID3PRO005;Pro Steak Japanese Sauce 250ml - Indoguna;0.0310;3.1
FID3PRO004;Pro Steak Gravy Sauce 250ml - Indoguna;0.0310;3.1
FID3PRO003;Pro Steak Brown Sauce 250ml - Indoguna;0.0310;3.1
FID3PRO014;Pro Steak Galbi / Kalbi Sauce 250ml - Indoguna;0.0310;3.1
FID3PRO013;Pro Steak Bulgogi Sauce 250ml - Indoguna;0.0310;3.1
FID3PRO002;Pro Steak Black Pepper Sauce 250 ml - Indoguna;0.0310;3.1
FID3PRO001;Pro Steak Barbecue Sauce 250 ml - Indoguna;0.0310;3.1
FID3PRO006;Pro Steak Marinated Steak Sauce 250 ml - Indoguna;0.0310;3.1
AID2OLS073;Wagyu Beef Karubi Plate MB 9 Daging Slice - INDOGUNA;0.0310;3.1
AID2OLS072;Wagyu Beef Chuck Roll MB 9 Daging slice - INDOGUNA;0.0310;3.1
AID2OLS074;US PRIME HANGING TENDER 'SLICE' 250GR - DAGING SLICE - INDOGUNA;0.0310;3.1
AID2OLS154;Daging Kerbau Allana Murah Halal Tanpa Tulang - Indoguna;0.0310;3.1
MAT3DBO034;Diabetic Darbo Blueberry Reform - Selai Rendah Gula - Indoguna;0.0310;3.1
MAT3DBO035;Diabetic Darbo Orange Marmalade Reform - Selai Rendah Gula - Indoguna;0.0310;3.1
MAT3DBO033;Diabetic Darbo Strawberry Reform - Selai Rendah Gula - Indoguna;0.0310;3.1
MAT3DBO032;Diabetic Darbo Raspberry Reform - Selai Rendah Gula - Indoguna;0.0310;3.1
MAT3DBO031;Diabetic Darbo Apricot Reform - Selai Aprikot Rendah Gula - Indoguna;0.0310;3.1
MAT3DBO006;Darbo Forest Honey - Madu Hutan 500 gram;0.0310;3.1
EAT3DBO004;Darbo Sunflower Creamy Honey - Madu Bunga Matahari 500 gram;0.0380;3.8
MAT3DBO007;Darbo Flower Honey - Madu Bunga 500 gram;0.0380;3.8
EAT3DBO003;Darbo Acacia Honey - Madu Akasia Darbo 500 gram;0.0380;3.8
FIT3SAL001;Extra Virgin Olive Oil Salvadori 1 liter dari Italia - Indoguna;0.0310;3.1
AID2OLS068;Australia Blade Cut Yakiniku - Daging Slice Yakiniku Blade Australia;0.0310;3.1
AID2OLS065;US Beef Galbi-Kalbi MB 4 / Daging Sapi Galbi-Kalbi MB 4 - 250GR;0.0310;3.1
AID2OLS040;AUS Tomahawk S GF Angus / Daging Sapi Tomahawk S GF Angus;0.0310;3.1
AID2OLS063;"AUS - Wagyu Striploin MB 7 ""Slice Shabu"" - Daging Sapi Wagyu MB 7";0.0310;3.1
AID2OLS060;"NZ - Tongue ""Slice Yakiniku"" / Lidah Sapi "" Potongan Yakiniku""";0.0310;3.1
AID2OLS062;AUS - Tenderloin A / Daging Steak Tenderloin A;0.0310;3.1
AID2OLS057;US Ribeye Lip On Prime - Daging Steak Sapi Ribeye Lip On Prime;0.0310;3.1
AID2OLS041;;0.0310;3.1
AID2OLS055;AUS - Wagyu Striploin MB 7 / Daging Steak Wagyu Sirloin MB 7;0.0310;3.1
AID2OLS046;AUS - Shank 1 KG / Daging Sapi Sengkel 1 KG;0.0310;3.1
AID2OLS056;AUS - TENDERLOIN HORMON FREE / DAGING SAPI BEBAS HORMON STEAK 200GR;0.0310;3.1
AID2OLS053;USA - TENDERLOIN PRIME / DAGING SAPI TENDERLOIN CUT STEAK 200G;0.0310;3.1
AID2OLS052;AUS RIB EYE HORMON FREE / DAGING SAPI STEAK BEBAS HORMON 200GR;0.0310;3.1
GID2TAL001;NZ FRIES SHOESTRING 1KG;0.0310;3.1
GNZ2TAL001;NZ FRIES STRAIGHT CUT 2,5 KG;0.0310;3.1
AID2OLS058;US Striploin Prime 'Slice Shabu' -+ 250GR;0.0310;3.1
AID2OLS036;US BEEF CHUCK GALBI-KALBI MB 4 / DAGING SAPI KALBI MB 4;0.0310;3.1
AID2OLS051;US Prime Ribeye Roll - Daging Steak US Ribeye Prime;0.0310;3.1
AID2OLS048;;0.0310;3.1
AID2OLS003;Beef Shredded / Trimmingan Daging Sapi;0.0310;3.1
AID2OLS050;Aus Beef Tail Center Cut / Buntut Sapi Potongan Tengah;0.0310;3.1
EID1MIU001;KIMCHI HALAL 1,2 KG;0.0380;3.8
AID2OLS070;"US Prime Chuck Short Rib Boneless ""Slice Shabu""";0.0310;3.1
AID2OLS035;;0.0310;3.1
AID2OLS034;Daging Sapi - AUS Beef Slice Shabu -+500 GR;0.0310;3.1
AID2OLS045;AUS Striploin A Sliced Beef - Daging Sapi Sliced Striploin A / 500 GR;0.0310;3.1
OL0022;Big Shopping Bag / Tas Belanja Kain Ukuran Besar - Edisi Kemerdekaan;0.0450;4.5
AID2OLS043;US Beef Galbi-Kalbi MB 2 / Daging Sapi Galbi-Kalbi MB 2 -+500 GR;0.0310;3.1
AID2OLS042;US Beef Clod Prime MB4 - Shabu Sliced / 500 GR;0.0310;3.1
EID3KEW002;Kewpie Base Type Mayonnaise 1 KG;0.0310;3.1
FKR3JSG005;Topokki Sauce Sweet & Spicy / Saus Topokki Manis Pedas 235 GR;0.0310;3.1
EID3KEW010;Kewpie Cheese Mayo - Cooking Sauce 1 KG;0.0310;3.1
EID3KEW004;Kewpie Baking Mayonnaise 1 KG;0.0310;3.1
AID2OLS033;US Striploin Prime Angus CAB / Daging Steak Angus Prime CAB 200GR;0.0310;3.1
GID2OLS004;Kentang Goreng Skin On Premium Butter coated -Transfat Free;0.0310;3.1
AID2OLS059;US Beef Galbi-Kalbi MB 4 / Daging Sapi Galbi-Kalbi MB 4 -+500 GR;0.0310;3.1
AID2OLS032;Wagyu Striploin MB 7 / Daging Steak Wagyu Sirloin 200 GR;0.0310;3.1
AID2OLS028;AUS - Wagyu Ribeye MB 7 / Daging sapi AUS Wagyu Ribeye MB 7;0.0310;3.1
FKR3JSG010;Jinsung Korean Kalbi BBQ Sauce 500 Gram;0.0310;3.1
FES3LAR018;Extra Virgin Olive Oil - Special Coupage La Rambla 500 ml;0.0310;3.1
GID2OLS003;Potato Steak Fries / Kentang Goreng Potongan Tebal 1 KG;0.0310;3.1
BID2IGU121;Elprimo Sosis Sapi Daging Keju / Elprimo Beef Cheese Sausage 500 GR;0.0310;3.1
EIT3DEC022;Spaghetti - De Cecco Pasta 500 GR;0.0310;3.1
EIT3DEC030;Fettucine - De Cecco Pasta 250 GR;0.0310;3.1
EIT3DEC020;Penne Rigate - De Cecco Pasta - 500 GR;0.0310;3.1
EKR3YOP002;YOPOKKI HALAL ORIGINAL (Topokki / Tteokbokki) 140 GR;0.0380;3.8
EKR3YOP003;YOPOKKI HALAL ORIGINAL (Topokki / Tteokbokki) 280 GR;0.0380;3.8
EKR3YOP004;YOPOKKI HALAL JJAJANG - MANIS (Topokki / Tteokbokki) 140 GR;0.0380;3.8
EKR3YOP005;YOPOKKI HALAL JJAJANG -MANIS (Topokki / Tteokbokki) 280 GR;0.0380;3.8
EKR3YOP006;YOPOKKI HALAL SPICY - PEDAS (Topokki / Tteokbokki) 140GR;0.0380;3.8
EKR3YOP007;YOPOKKI HALAL SPICY - PEDAS (Topokki / Tteokbokki) 280 GR;0.0380;3.8
GID2OLS002;Sweet Potato / Ubi Premium;0.0310;3.1
AID2OLS024;Daging Patties Kotak / Square Beef Patties 450GR / 5 PC;0.0310;3.1
AID2LOC041;US Premium Saikoro - 100% Daging Halal;0.0310;3.1
HSG1EMM001;Emmi Premium Yoghurt from Swiss;0.0310;3.1
AID2OLS037;Daging Giling Premium / Premium Ribeye Ground Beef - LOW FAT;0.0310;3.1
GID2OLS001;USA - Potato Wedges / Kentang Wedges Bumbu Original 500 gr;0.0310;3.1
EID3KEW008;kewpie salad dressing thousand island;0.0310;3.1
EID3KEW006;kewpie salad dressing soy sauce;0.0310;3.1
EID3KEW005;kewpie salad dressing roasted sesame;0.0310;3.1
EID3KEW007;kewpie salad dressing caesar;0.0310;3.1
EID3KEW009;kewpie salad dressing spicy tomato;0.0310;3.1
EID3KEW001;mayonaise original / kewpie original mayonaise;0.0310;3.1
HBE3CDM005;Countre Vanilla Milk / Susu Countre Rasa Vanilla;0.0310;3.1
HBE3CDM003;Countre Peach Mango Milk / Susu Countre Rasa Peach Mangga;0.0310;3.1
HBE3CDM001;Countre Banana Milk / Susu Countre Rasa Pisang;0.0310;3.1
AID2OLS027;US - Choice Short Rib Bone In / Daging Iga Sapi 500 gr;0.0310;3.1
AID2OLS010;US - Prime Striploin / Daging Steak Sapi 200gr;0.0310;3.1
AID2OLS009;US - Striploin Select / Daging Steak Sapi 200gr;0.0310;3.1
AID2OLS019;AUS - Striploin Black Angus - Grass Fed - Hormone Free 200 gr;0.0310;3.1
AID2OLS018;AUS - Daging Sapi 1 KG BLADE -Black Angus -Hormone Free - Grass Fed;0.0310;3.1
AID2OLS021;AUS - Premium Ribeye black angus / Daging Sapi cut Steak 200 gr;0.0310;3.1
AID2OLS023;AUS - premium yakiniku / shabu2 PE brisket YG / daging sapi slice;0.0310;3.1
AID2OLS007;USA - Tenderloin NR grain fed / daging sapi steak;0.0310;3.1
GID2TAS005;Tasty Fries Straight Cut Plain / kentang beku;0.0310;3.1
GID2TAS003;Tasty Fries Crinkle Cut Plain / kentang beku;0.0310;3.1
GID2TAS002;Tasty Fries Shoestring Batter Coated / kentang beku;0.0310;3.1
AID2OLS005;Aus Beef Tail Mix Cut / Buntut sapi Potongan campur / Pack +- 500 gram;0.0310;3.1
AID2OLS004;Aus Beef Tail End Cut / Buntut sapi End cut /Pack +- 500 gram;0.0310;3.1
AID2OLS017;Premium Yakiniku + Shabu. US Prime Beef (A001);0.0310;3.1
AID2OLS015;Premium Yakiniku - US Certified Angus Beef (A002);0.0310;3.1
AID2OLS014;Premium Yakiniku - US Outside Skirt Choice (A003);0.0310;3.1
AID2OLS016;Premium Yakiniku - US Short Rib Bone Less Choice (A004);0.0310;3.1
IUS2NAT001;Natalie's Orange Juice Fresh Frozen;0.0380;3.8
IUS2NAT007;Natalie's Lime Juice Fresh Frozen;0.0380;3.8
IUS2NAT006;Natalie's Grapefruit Juice Fresh Frozen;0.0380;3.8
IUS2NAT004;Natalie's Blood Orange Juice Fresh Frozen;0.0380;3.8
IUS2NAT003;Natalie's Tangerine Juice Fresh Frozen;0.0380;3.8
IUS2NAT002;Natalie's Lemon Juice Fresh Frozen;0.0380;3.8
AID2OLS006;AUS - Striploin Sliced PR Grain Fed / Daging Sapi Slice Premium;0.0310;3.1
AID2OLS012;AUS - Striploin Sliced Hormone Free / Daging sirloin slice;0.0310;3.1
AID2OLS064;Sirloin Steak Australia Bebas Hormon / AUS-Sirloin Steak Hormone Free;0.0310;3.1
FKR3JSG009;Jinsung Korean Bulgogi Sauce 500 Gram;0.0310;3.1
BID2IGU162;Sosis Ayam Bawang / Chicken Garlic Sausage;0.0310;3.1
BID2IGU034;Basko Sapi Super 750gr / Super Meatball;0.0310;3.1
BID2IGU076;Daging Sapi Asap / Smoked Beef 500 Gram;0.0310;3.1
BID2IGU029;Daging Sapi Pastrami / Pastrami Beef 500 Gram;0.0310;3.1
BID2IGU078;"Daging Sapi Asap “Brisket US” / US Smoked Beef "" Brisket""";0.0310;3.1
BID2IGU077;"Daging Sapi Asap “Shortplate US” / US Smoked Beef ""Shortplate""";0.0310;3.1
BID2IGU117;Sosis Ayam Bratwurst / Chicken Bratwurst Sausage;0.0310;3.1
BID2IGU115;Sosis Keju Daging Ayam / Chicken Cheese Sausage;0.0310;3.1
BID2IGU159;"Sosis Daging Ayam Premium ""Breakfast"" / Chicken Breakfast Premium";0.0310;3.1
BID2IGU160;"Sosis Daging Sapi Premium ""Breakfast"" / Beef Breakfast Sausage";0.0310;3.1
AID2OLS002;Daging Sapi Import 1 KG;0.0310;3.1
AID2OLS001;Daging sapi - US Shortplate Beef Slice /pack +-500 Gram;0.0310;3.1
EIT3BAL002;BALCONI WAFER CUBI HAZZENUT 250GR;0.0380;3.8
AAU2HRV077;AUS RUMP CAP PICANHA GRAIN FED HARVEY WHOLE;0.0310;3.1
AID2LOC085;Daging Sapi Rendah Lemak 1Kg;0.0310;3.1
AID2LOC088;DAGING STEAK RIBEYE MURAH / CUBE ROLL 200GR;0.0310;3.1
AID2LOC087;DAGING STEAK SIRLOIN MURAH 200GR (PROMOSI DESEMBER);0.0310;3.1
EID2KEW001;KEWPIE SCRAMBLED EGG BASE;0.0310;3.1
EID3KEW035;KEWPIE MENTAI MAYO;0.0310;3.1
EID3KEW012;KEWPIE ROASTED SESAME MAYO (COOKING SAUCE);0.0310;3.1
EID2KEW008;KEWPIE JAPANESE CURRY SAUCE;0.0310;3.1
EID3KEW032;KEWPIE TARTAR SAUCE;0.0310;3.1
GID2TAS001;NZ FRIES SHOESTRING 1KG;0.0310;3.1
AID2OLS136;AUS Wagyu Striploin MB4 Shabu-shabu 250gr - Indoguna;0.0310;3.1
AID2LOC052;AUS CHUCK CREST GRADE S CUT STEAK 200GR;0.0310;3.1
FKR3JSG002;Jinsung Korean Kalbi BBQ Sauce 500 Gram;0.0310;3.1
AID2OLS067;AUS Short Rib Bone In Center Cut 3x3 cm Cube - Indoguna;0.0310;3.1
FKR3JSG001;Jinsung Korean Bulgogi Sauce 500 Gram;0.0310;3.1
FIT3CIA005;Ciao Tomato Paste - Pasta Tomat 800 GR;0.0310;3.1
AID2OLS104;AUS SHORTRIB B/IN GREEN HAM CUT 3X3;0.0310;3.1
AID2LOC086;Wagyu Beef Karubi Plate MB 9;0.0310;3.1
FES3LAR017;LA RAMBLA EXTRA VIRGIN OLIVE OIL 250ML;0.0310;3.1
AID2OLS122;AUS SHORTRIB B/IN CENTER CUT IW (3X3 CUBE) 500GR;0.0310;3.1
AID2LOC094;US PREMIUM TONGUE CUT YAKINIKU 250GR;0.0310;3.1
HSZ1EMM007;EMMI GREEK STYLE RASPBERRY 2% YOGHURT 150GR;0.0310;3.1
HSZ1EMM004;EMMI GREEK STYLE NATURE 4% YOGHURT 150GR;0.0310;3.1
HSZ1EMM008;EMMI GREEK STYLE BLUEBERRY 2% YOGHURT 150GR;0.0310;3.1
HSG1EMM002;EMMI STRAWBERRY YOGHURT 1 KG;0.0310;3.1
HSG1EMM016;EMMI NATURAL YOGHURT 1 KG;0.0310;3.1
HSG1EMM015;EMMI BLUEBERRY YOGHURT 1 KG;0.0310;3.1
HSG1EMM008;EMMI STRAWBERRY YOGHURT 100G;0.0310;3.1
HSG1EMM005;EMMI BLUEBERRY YOGHURT 100G;0.0310;3.1
HSG1EMM006;EMMI  NATURAL YOGHURT  100G;0.0310;3.1
HSG1EMM001;EMMI  ALOE VERA YOGHURT 100G;0.0310;3.1
HSG1EMM014;EMMI  GRAPEFRUIT YOGHURT  100G;0.0310;3.1
HSG1EMM007;EMMI  RASPBERRY YOGHURT 100G;0.0310;3.1
HSG1EMM004;EMMI  APRICOT YOGHURT 100G;0.0310;3.1
DCN2KIN002;GIANT SQUID TUBE 1 KG;0.0310;3.1
AID2LOC094;US PREMIUM TONGUE CUT YAKINIKU 250GR;0.0310;3.1
AID2LOC105;AUS STRIPLOIN PR GRAIN FED CUT STEAK 200 GR;0.0310;3.1
AID2LOC106;AUS WAGYU STRIPLOIN GRAIN FED MB 7 CUT STEAK 250 GR;0.0310;3.1
AID2LOC107;AUS TENDERLOIN WAGYU MB 4 CUT STEAK 200 GR;0.0310;3.1
AID2LOC108;AUS WAGYU KNUCKLE MB 7 CUT YAKINIKU 250 GR;0.0310;3.1
AID2LOC109;AUS WAGYU LOIN MB 9 CUT STEAK 150 GR;0.0310;3.1
AID2LOC110;AUS WAGYU KNUCKLE MB 7 CUT SHABU SHABU 250 GR;0.0310;3.1
DCN2KIN003;GIANT SQUID RING 1 KG;0.0310;3.1
FES1PES001;PESCAVIAR AVRUGA 120GR;0.0310;3.1
AID2LOC025;US SHORTRIB B/LESS CAB CUT SHABU 250GR;0.0310;3.1
AID2LOC022;US SHORTRIB B/LESS CAB CUT YAKINIKU 250GR;0.0310;3.1
DID2WBS006; VANNAMEI SHRIMP HOSO SIZE 31-40 (10X1KG);0.0310;3.1
